,title,rating,date,review,CommentAferPreproc,sentiment,Topic,Topic_label
810,Avis Nickel ,"2,3 sur 5 étoiles",08/07/2022,"banque de plus en plus incompétante, ils font passer des paiements par cartes internet frauduleuses alors que l´option paiements internet est bloqué. impossible de les joindre et impossible de faire quoi que ce soit. je n ai fait aucun paiement internet vu que celui ci est bloqué. je ne suis pas là seule dans ce cas là, depuis hier plusieurs personnes ont eu la même chose que moi et nickel ne s´en occupe pas.",banque plus plus incompétante font passer paiements cartes internet frauduleuses alors option paiements internet bloqué impossible joindre impossible faire quoi fait aucun paiement internet vu celui ci bloqué là seule cas là depuis hier plusieurs personnes chose nickel occupe,Negative,4,service
811,Avis Nickel ,"3,6 sur 5 étoiles",01/07/2022,"l'ouverture du compte est pratique et rapide. par contre pour le reste, tout est à revoir. les frais sont exorbitants. par exemple pour les chèques, j'étais content de voir qu'ils acceptaient enfin le dépôt de chèque, mais il faut attendre 5 semaines avant que le chèque ne soit encaissé une fois qu'ils l'ont reçu, et je ne parle pas des frais, 3 € pour une remise de chèque !",ouverture compte pratique rapide contre reste tout revoir frais exorbitants exemple chèques content voir acceptaient enfin dépôt chèque faut attendre semaines avant chèque encaissé fois reçu parle frais remise chèque,Positive,4,service
812,Avis Nickel ,"2,4 sur 5 étoiles",16/06/2022,j'ai effectué un virement le 10 de ce compte nickel et aujourd'hui il n'est toujours pas arrivé sur mon autre compte. pas de service client disponible qui m'envoie que des mails standard. aucune explication sinon que je dois patienter. je déconseille cette banque q,effectué virement 10 compte nickel aujourd hui toujours arrivé autre compte service client disponible envoie mails standard aucune explication sinon dois patienter déconseille cette banque,Positive,6,accueil
813,Avis Nickel ,"2,5 sur 5 étoiles",14/06/2022,"virement fait dans l’urgence via un autre compte bancaire. fait le vendredi toujours pas sur le compte le mercredi suivant. alors que dans les autres banques banques, cela est fait bien plus rapidement.",virement fait urgence via autre compte bancaire fait vendredi toujours compte mercredi suivant alors autres banques banques cela fait bien plus rapidement,Negative,6,accueil
814,Avis Nickel ,"4,8 sur 5 étoiles",23/05/2022,"je suis client nickel depuis 6 ans et ing depuis 5 ans. je suis très satisfaite de nickel, rien à dire. jamais de problème. j'ai du prendre contact par téléphone une dizaine de fois et toujours bien servie.ing déçue suite à un montant conteste de débit sur mon compte et la fermeture avec proposition de boursorama qui en trois jours m'ont prouvé leur incapacité.",client nickel depuis ans ing depuis ans très satisfaite nickel rien dire jamais problème prendre contact téléphone dizaine fois toujours bien servie ing déçue suite montant conteste débit compte fermeture proposition boursorama trois jours prouvé incapacité,Negative,5,personnel
815,Avis Nickel ,"2,4 sur 5 étoiles",12/05/2022,"compte ouvert le 9 mai 2022 : facile bravo super nous avons les félicitations de nickel pour avoir choisi cette carte! nous allons la retirer au tabac en donnant 20 euros : pour le moment nous sommes satisfaits!le 10 mai 2022 un mail annonce que le compte a été clôturé sans autre explication, je téléphone sans grand résultat. donc j'écris à sos contact, la réponse arrive le lendemain pour dire que le compte est clôturé définitivement! je renvoie un mail dans la foulée car j'aimerais bien comprendre le pourquoi. finalement pour un compte que nous avons gardé même pas 24 heures, 20 euros c'est cher payé!",compte ouvert mai 2022 facile bravo super félicitations nickel avoir choisi cette carte allons retirer tabac donnant 20 euros moment satisfaits 10 mai 2022 mail annonce compte clôturé sans autre explication téléphone sans grand résultat donc écris sos contact réponse arrive lendemain dire compte clôturé définitivement renvoie mail foulée car aimerais bien comprendre pourquoi finalement compte gardé 24 heures 20 euros cher payé,Positive,6,accueil
816,Avis Nickel ,"3,0 sur 5 étoiles",27/04/2022,"plus jamais je ne mettrai de chèque bancaire de salaire sur le compte nickel, j ai mis un chèque de mon employeur le 05/04/22, ce fameux chèque ne sera seulement disponible le 2 mai 2022, publicité mensongère concernant le délai de traitement de 15 jours.",plus jamais mettrai chèque bancaire salaire compte nickel mis chèque employeur 05 04 22 fameux chèque seulement disponible mai 2022 publicité mensongère concernant délai traitement 15 jours,Positive,5,personnel
817,Avis Nickel ,"3,2 sur 5 étoiles",23/04/2022,"cela fait 2 ans que je suis chez nickel je recommande vivement. maintenant qu'on peut déposer un chèque c'est un plus mais les délais sont longs il faudrait raccourcir le délai,15 jours c'est long. j'espère qu'il aura une mise à jour pour mettre la carte sur apple pay, là ce serait le top. continuez comme vous êtes.",cela fait ans chez nickel recommande vivement maintenant peut déposer chèque plus délais longs faudrait raccourcir délai 15 jours long espère mise jour mettre carte apple pay là top continuez comme,Negative,0,service
818,Avis Nickel ,"2,4 sur 5 étoiles",20/04/2022,"je suis cliente depuis 4 ans et jamais de problème. et là, je me suis fait pirater ma carte et après avoir fait opposition et renvoyé les documents demandés, on me dit que j'ai trop tardé à faire opposition, alors pas de remboursement. même en leur montrant la preuve que c'est une arnaque car on essaie encore de prélever sur mon ancienne carte. très déçue.",cliente depuis ans jamais problème là fait pirater carte après avoir fait opposition renvoyé documents demandés dit trop tardé faire opposition alors remboursement montrant preuve arnaque car essaie encore prélever ancienne carte très déçue,Negative,6,accueil
819,Avis Nickel ,"2,6 sur 5 étoiles",19/04/2022,"pas mal dans l'ensemble, de toute façon, dans n'importe quelle banque ça va toujours tant qu'il y a de l'argent sur votre compte. le bon vieux temps nickel est révolu, maintenant c'est bnp parisbas qui tire les ficelles avec de plus en plus de frais. surtout en ce qui concerne les frais pour chaque dépôt de chèque ( 3€ ) mais le plus scandaleux, c'est que l'on vous annonce 15 jours de traitement en jours ouvrés. j'ai déposé un chèque le 23 mars 2022 il sera crédité sur mon compte que le 25 avril 2022, soit pratiquement un mois d'attente et en plus des 3€ de frais nickel.",mal ensemble toute façon importe quelle banque ça va toujours tant argent compte bon vieux temps nickel révolu maintenant bnp parisbas tire ficelles plus plus frais surtout concerne frais chaque dépôt chèque plus scandaleux annonce 15 jours traitement jours ouvrés déposé chèque 23 mars 2022 crédité compte 25 avril 2022 pratiquement mois attente plus frais nickel,Positive,4,service
820,Avis Nickel ,"3,2 sur 5 étoiles",18/04/2022,"je suis client compte nickel depuis 5 ans mais là vraiment je suis décu ! lundi dernier je tombe en panne de voiture, j´ai droit à un véhicule de remplacement par mon assurance, on me demande ma cb pour pouvoir partir avec la voiture m'assurant que je ne serai pas débité. surprise en rentrant j'ai bel et bien été débité de 660 euros ! en cherchant un peu étant donné que c'est une carte à débit immédiat c'est normal, mais là où je suis vraiment pas contente du tout c'est que nickel met un délai de 31 jours pour régulariser et remettre la somme sur le compte ! j'ai des réparations de voiture à payer ! j'attends 1 mois. pour gagner de l'argent pour mettre sur mon fameux compte nickel il me faut ma voiture.",client compte nickel depuis ans là vraiment décu lundi dernier tombe panne voiture droit véhicule remplacement assurance demande cb pouvoir partir voiture assurant débité surprise rentrant bel bien débité 660 euros cherchant peu donné carte débit immédiat normal là où vraiment contente tout nickel met délai 31 jours régulariser remettre somme compte réparations voiture payer attends mois gagner argent mettre fameux compte nickel faut voiture,Positive,3,service
821,Avis Nickel ,"2,6 sur 5 étoiles",12/04/2022,"cette banque réalise deux prélèvements sur mon compte pour payer une facture par carte bancaire et refuse de me rembourser, j'ai dû apporter les preuves avec le commerçant pour obtenir gain de cause après 2 mois de bataille. pour expliquer rapidement, je paye une facture d'un montant x et nickel me prélève deux fois ce montant et pour eux c'est moi qui aurai payé deux fois à la même heure chez ce commerçant.cette banque bloque votre carte bancaire après un seul code pin faux, et vous oblige à commander une nouvelle carte à vos frais (20 euros) alors que vous apportez toutes les preuves que l'erreur est de leur part.",cette banque réalise deux prélèvements compte payer facture carte bancaire refuse rembourser dû apporter preuves commerçant obtenir gain cause après mois bataille expliquer rapidement paye facture montant nickel prélève deux fois montant payé deux fois heure chez commerçant cette banque bloque carte bancaire après seul code pin faux oblige commander nouvelle carte frais 20 euros alors apportez toutes preuves erreur part,Positive,6,accueil
822,Avis Nickel ,"2,2 sur 5 étoiles",11/04/2022,"j'étais cliente depuis le début 2014, et peu à peu des doublons de débits ? une carte bancaire que je ne peux activer et qui m'a été débité 20€ en 2019. j'ai tout viré sur mon compte caisse d'epargne. mon buraliste a supprimé son comptoir nickel, trop de personne insatisfaites et en colère.",cliente depuis début 2014 peu peu doublons débits carte bancaire peux activer débité 20 2019 tout viré compte caisse epargne buraliste supprimé comptoir nickel trop personne insatisfaites colère,Negative,2,frais
823,Avis Nickel ,5 sur 5 étoiles,25/02/2022,depuis 5 ans tout est.. . . nickel. il n'en est pas de même pour un ami que j'ai parrainé. mais là il semble que c'est un pb avec le tabac où l'inscription s'est faite. par ma part je n'ai eu besoin du service client qu´une seule fois et tout s'est bien passé.,depuis ans tout nickel ami parrainé là semble pb tabac où inscription faite part besoin service client seule fois tout bien passé,Positive,4,service
824,Avis Nickel ,"2,0 sur 5 étoiles",13/02/2022,"je déconseille d’ouvrir un compte nickel parce que au moindre petit truc (genre rejet de prélèvement ou autre) ils vous bloquent le compte, voir le clôturent. en plus chez nickel il faut régulièrement changer de carte à cause des problèmes de piratages. moi j’ai eu des prélèvements qui sont apparus de je ne sais où à plusieurs reprises sur mon compte et j’ai dû faire opposition.",déconseille ouvrir compte nickel parce moindre petit truc genre rejet prélèvement autre bloquent compte voir clôturent plus chez nickel faut régulièrement changer carte cause problèmes piratages prélèvements apparus sais où plusieurs reprises compte dû faire opposition,Positive,6,accueil
825,Avis Nickel ,"4,6 sur 5 étoiles",11/02/2022,"entière satisfaction. suite à des achats frauduleux en ligne, nickel m'a remboursé (avec malheureusement des démarches et envoi de documents à plusieurs reprises ). interlocutrices pas toujours aimables, ni patientes.",entière satisfaction suite achats frauduleux ligne nickel remboursé malheureusement démarches envoi documents plusieurs reprises interlocutrices toujours aimables ni patientes,Positive,6,accueil
826,Avis Nickel ,"2,3 sur 5 étoiles",07/02/2022,"après avoir payé par mon loyer, mon électricité (paiement sécurisé), voilà que quelques jours plus tard je suis débité des mêmes montants et mise à découvert. mes prélèvements seront rejetés. lors de l’entretien téléphonique le conseiller a reconnu l’erreur de nickel. néanmoins le retour à la normale mettrait 8 jours ouvrables. 8 jours le compte bloqué, découvert de 500 € sur un compte largement créditeur sans compter les futurs frais de rejet de prélèvements.",après avoir payé loyer électricité paiement sécurisé voilà quelques jours plus tard débité mêmes montants mise découvert prélèvements rejetés lors entretien téléphonique conseiller reconnu erreur nickel néanmoins retour normale mettrait jours ouvrables jours compte bloqué découvert 500 compte largement créditeur sans compter futurs frais rejet prélèvements,Positive,6,accueil
827,Avis Nickel ,"1,8 sur 5 étoiles",08/01/2022,"nickel a refusé de me rembourser une opération frauduleuse dont je ne suis pas responsable. avec toutes les preuves présentées afin de prouver ma non-responsabilité de ce prélèvement frauduleux, nickel ne m'a pas remboursé !",nickel refusé rembourser opération frauduleuse dont responsable toutes preuves présentées afin prouver non responsabilité prélèvement frauduleux nickel remboursé,Positive,3,service
828,Avis Nickel ,"1,6 sur 5 étoiles",02/12/2021,"mon compte nickel est bloqué depuis plus de 15 jours, le service client ne sait me dire pourquoi et ne sait pas non plus me dire combien de temps cela va prendre pour transférer mes fonds sur mon nouveau compte de la société générale.",compte nickel bloqué depuis plus 15 jours service client sait dire pourquoi sait non plus dire combien temps cela va prendre transférer fonds nouveau compte société générale,Positive,4,service
829,Avis Nickel ,"4,8 sur 5 étoiles",29/11/2021,je suis cliente nickel depuis des années et suis totalement satisfaite. j'ai eu un petit problème de connexion à l'application et ai bénéficié d'un suivi client parfait. je ne peux que recommander.j'ai connu bien des banques qui n'ont pas été aussi disponibles. de plus on connaît la situation du compte immédiatement.et maintenant on peut même déposer des chèques !,cliente nickel depuis années totalement satisfaite petit problème connexion application bénéficié suivi client parfait peux recommander connu bien banques aussi disponibles plus connaît situation compte immédiatement maintenant peut déposer chèques,Positive,0,service
830,Avis Nickel ,"1,4 sur 5 étoiles",12/11/2021,"cliente depuis 7 ans, j'ai vu les prestations se dégrader et les prix gonfler.cette néobanque qui se veut soit disant 2 fois moins onéreuse qu'une banque classique est en réalité bien plus chère (1,5 eur pour un retrait, 1€ si vous demandez le renvoi de votre code de carte, 10€ par prélèvement bloqué (je suis en litige avec free, j'ai donc bloqué le prélèvement, il n'est donc pas débité, mais nickel prélève chaque mois 20 voire 30€ de frais de rejets, car free tente de prélever 1, 2 voire trois fois par mois).en outre, quand vous tentez de joindre un conseiller client, votre interlocuteur est un véritable robot qui ne fait que répéter les cgv. enfin, il y a de nombreux bugs, la carte qui ne passe pas alors que vous avez de l'argent et pas atteint vos plafonds, le site qui plante.pour ma part, je vais changer de banque et mon compagnon aussi.",cliente depuis ans vu prestations dégrader prix gonfler cette néobanque veut disant fois moins onéreuse banque classique réalité bien plus chère eur retrait si demandez renvoi code carte 10 prélèvement bloqué litige free donc bloqué prélèvement donc débité nickel prélève chaque mois 20 voire 30 frais rejets car free tente prélever voire trois fois mois outre quand tentez joindre conseiller client interlocuteur véritable robot fait répéter cgv enfin nombreux bugs carte passe alors argent atteint plafonds site plante part vais changer banque compagnon aussi,Positive,4,service
831,Avis Nickel ,"1,5 sur 5 étoiles",25/10/2021,"expériences négatives:1ere fois : carte demagnétisée pour avoir fait 6 fois un mauvais code (chercher l'erreur).2ème fois : je recommande une carte à mes frais, et au moment de retirer ma carte est avalée (code confidentiel correct ), pour cause , le dab est défectueux, veuillez acheter une nouvelle carte à vos, bien sûr.",expériences négatives 1ere fois carte demagnétisée avoir fait fois mauvais code chercher erreur 2ème fois recommande carte frais moment retirer carte avalée code confidentiel correct cause dab défectueux veuillez acheter nouvelle carte bien sûr,Positive,3,service
832,Avis Nickel ,5 sur 5 étoiles,15/10/2021,"compte bancaire avec une organisation qui leur est propre, mais plutôt sympa car pas énormément de frais contrairement à d'autres banques.pas de découvert possible, compte client en ligne et à jour instantanément près un paiement.utilisation au quotidien de ma carte.",compte bancaire organisation propre plutôt sympa car énormément frais contrairement autres banques découvert possible compte client ligne jour instantanément près paiement utilisation quotidien carte,Positive,0,service
833,Avis Nickel ,"4,6 sur 5 étoiles",08/10/2021,"je suis client nickel depuis plusieurs mois et pour moi c'est une banque plutôt simple et agréable.j'ai toujours été averti des différents mouvements, donc pas de surprise de ce côté là. les frais sont normaux comparés à mes précédentes banques et je trouve le service client assez bon côté réactivité.je recommande donc cette banque pour un dépannage courant mais cependant j'attends encore un peu plus de leur part. aux dernières nouvelles il était possible d'encaisser des chèques. a poursuivre donc.",client nickel depuis plusieurs mois banque plutôt simple agréable toujours averti différents mouvements donc surprise côté là frais normaux comparés précédentes banques trouve service client assez bon côté réactivité recommande donc cette banque dépannage courant cependant attends encore peu plus part dernières nouvelles possible encaisser chèques poursuivre donc,Positive,4,service
834,Avis Nickel ,"1,0 sur 5 étoiles",17/09/2021,"banque en ligne qui n'aime pas que l'on dispose de notre argent ou que l'on effectue des virements sur d'autres compte, de plus ils ont attendu de clôturer mon compte le lendemain du prélèvement de ma cotisation annuelle de la carte et ne m'ont jamais remboursé cette dernière. banque en ligne à fuir impérativement n26 étant largement moins chère et plus efficace.",banque ligne aime dispose argent effectue virements autres compte plus attendu clôturer compte lendemain prélèvement cotisation annuelle carte jamais remboursé cette dernière banque ligne fuir impérativement n26 largement moins chère plus efficace,Positive,6,accueil
835,Avis Nickel ,"3,0 sur 5 étoiles",10/09/2021,"jamais de découvert, compte toujours alimenté et je me suis fait dégager sans explications, sauf un article du contrat qui stipule que nickel peut vous dégager à volonté.aucune communication, je m'en suis aperçu quand j'ai eu une relance pour un impayé... puis j'ai appelé et envoyé des mails qui sont restés sans réponse pendant 1 mois, puis encore 1 mois pour récupérer l'argent qui était sur le compte.je deconseille fortement d'aller vers cette banque qui n'a de nickel que le nom, le réalité est bien différente.",jamais découvert compte toujours alimenté fait dégager sans explications sauf article contrat stipule nickel peut dégager volonté aucune communication aperçu quand relance impayé puis appelé envoyé mails restés sans réponse pendant mois puis encore mois récupérer argent compte deconseille fortement aller vers cette banque nickel nom réalité bien différente,Positive,4,service
836,Avis Nickel ,"1,0 sur 5 étoiles",21/08/2021,"j'avais pris un compte nickel pour la sécurité internet et zéro découvert, or ils ont accepté un prélèvement forcé qui m'a mis à découvert.maintenant je dois les rembourser, alors que je n'avais jamais autorisé ce prélèvement.c'est de l'abus, je deconseille absolument...fuyez nickel, une filiale de la bnp ?a déconseiller absolument",pris compte nickel sécurité internet zéro découvert or accepté prélèvement forcé mis découvert maintenant dois rembourser alors jamais autorisé prélèvement abus deconseille absolument fuyez nickel filiale bnp déconseiller absolument,Positive,5,personnel
837,Avis Nickel ,"1,0 sur 5 étoiles",17/08/2021,"compte fermé et bloqué sans explication.tardent à restituer vos fonds, (3 semaines que j'attends)ne répondent pas aux mails.ce que cette pseudo banque sait faire le mieux : des frais à chaque utilisation de votre carte!cette pseudo banque se permet même de vous prélever 20€ de cotisation annuelle le 26 juillet tout en clôtururant ce même compte le27 juillet !",compte fermé bloqué sans explication tardent restituer fonds semaines attends répondent mails cette pseudo banque sait faire mieux frais chaque utilisation carte cette pseudo banque permet prélever 20 cotisation annuelle 26 juillet tout clôtururant compte le27 juillet,Positive,6,accueil
838,Avis Nickel ,"1,8 sur 5 étoiles",13/08/2021,"blocage arbitraire de mon compte après plusieurs années d’utilisation.aucune réponse aux multiples mails, impossible de me faire virer le solde sur mon autre banque .par tel les agents ne peuvent rien faire, je dois en être à mon 15eme mails sans réponse. tout cela après avoir répondu à des demandes de justificatifs de domicile parce que je me servais de ma carte à l’étranger. tout cela après avoir reçu un mail en juin me confirmant que tout était en ordre.le 8/8 on me dit que le délai avant clôture définitive est passé et je n’ai plus aucun moyen d’agir sur le compte … depuis, je bataille pour récupérer mon solde !",blocage arbitraire compte après plusieurs années utilisation aucune réponse multiples mails impossible faire virer solde autre banque tel agents peuvent rien faire dois être 15eme mails sans réponse tout cela après avoir répondu demandes justificatifs domicile parce servais carte étranger tout cela après avoir reçu mail juin confirmant tout ordre dit délai avant clôture définitive passé plus aucun moyen agir compte depuis bataille récupérer solde,Positive,6,accueil
839,Avis Nickel ,"2,4 sur 5 étoiles",11/08/2021,"c'est vrai que c'est très rapide et simple, par contre attention, le plafond d'achat/retrait est de 1500€/mois.j'ai déposé plusieurs milliers mais mon argent est séquestré pour un mois minimum, incroyable. j'ai voulu upgrader ma carte pour pouvoir retirer + mais non impossible , confirmation du conseiller (très aimable mais soyez patient pour pouvoir les joindre).impossible de retirer son argent pendant 1 mois , un comble...",vrai très rapide simple contre attention plafond achat retrait 1500 mois déposé plusieurs milliers argent séquestré mois minimum incroyable voulu upgrader carte pouvoir retirer non impossible confirmation conseiller très aimable patient pouvoir joindre impossible retirer argent pendant mois comble,Positive,3,service
840,Avis Nickel ,"1,0 sur 5 étoiles",03/08/2021,"je déconseille fortement cette banque à croire que le sav est formé pour raccrocher au nez de ses clients. chose inadmissible, il faut près d’une semaine pour modifier le numéro de téléphone lié à l’espace client.généralement une demi-heure après un périple de touche xxxx qui nous prend une demi-journée pour ensuite exposer les soucis rencontrés propres à la banque nickel absente chez les autres banques concurrentes. service lamentable. a fuir !",déconseille fortement cette banque croire sav formé raccrocher nez clients chose inadmissible faut près semaine modifier numéro téléphone lié espace client généralement demi heure après périple touche xxxx prend demi journée ensuite exposer soucis rencontrés propres banque nickel absente chez autres banques concurrentes service lamentable fuir,Positive,0,service
841,Avis Nickel ,5 sur 5 étoiles,26/07/2021,"ça va faire 1 an que j’ai ouvert un compte nickel.je suis agréablement surprise. l’équipe ne manque pas de professionnalisme. ils sont aimables, à l’écoute, patients et ont toujours répondu à mes questions assez rapidement.tout ce que le client bancaire recherche aujourd’hui. sincèrement, je les recommande sans hésiter.",ça va faire an ouvert compte nickel agréablement surprise équipe manque professionnalisme aimables écoute patients toujours répondu questions assez rapidement tout client bancaire recherche aujourd hui sincèrement recommande sans hésiter,Positive,4,service
842,Avis Nickel ,"1,4 sur 5 étoiles",13/07/2021,"compte nickel pourrait être une bonne alternative malheureusement trop de soucis! une fois par mois au moins une fois j'ai un soucis avec eux. mon compte se trouve débiteur sans raison et aucune explication de nickel. en résumé service client zéro, par contre compte rapide à ouvri. et quand vous laissez un avis négatif, nickel bouge et prend le temps de vous rappelez en échange de quelque chose.bref je ne recommande pas cette banque.",compte nickel pourrait être bonne alternative malheureusement trop soucis fois mois moins fois soucis compte trouve débiteur sans raison aucune explication nickel résumé service client zéro contre compte rapide ouvri quand laissez avis négatif nickel bouge prend temps rappelez échange quelque chose bref recommande cette banque,Positive,4,service
