,title,rating,date,review,CommentAferPreproc,sentiment,Topic,Topic_label
616,Avis Crédit Agricole ,"2,4 sur 5 étoiles",14/07/2022,plus d’accès à l’évolution du compte. plus accès au budget. comment faire pour trier les opérations ? je ne vois pas l’évolution de l’application mais plutôt une régression de l’application. merci aux penseurs de nous remettre une application plus utile.,plus accès évolution compte plus accès budget comment faire trier opérations vois évolution application plutôt régression application merci penseurs remettre application plus utile,Positive,0,service
617,Avis Crédit Agricole ,5 sur 5 étoiles,13/07/2022,"j'y suis client depuis 3 ans et j'en suis extrêmement content. très à l'écoute. si problème ou question, tout est réglé rapidement. absolument rien à redire, je conseille plus que vivement, allez y les yeux fermés, que ce soit pour n'importe quel service, banque, assurance.",client depuis ans extrêmement content très écoute si problème question tout réglé rapidement absolument rien redire conseille plus vivement allez yeux fermés importe quel service banque assurance,Positive,4,service
618,Avis Crédit Agricole ,"1,8 sur 5 étoiles",11/07/2022,"nouvelle application lamentable. disparition de l’onglet « mon budget » qui était un véritable outil du quotidien. la navigation complètement peu intuitive. bref, on se demande qui a pu avoir une idée aussi stupide de changer l’application du tout au tout.",nouvelle application lamentable disparition onglet budget véritable outil quotidien navigation complètement peu intuitive bref demande pu avoir idée aussi stupide changer application tout tout,Negative,0,service
619,Avis Crédit Agricole ,"2,3 sur 5 étoiles",11/07/2022,"je suis cliente au crédit depuis plus de 40 ans et satisfaite jusqu’à aujourd’hui surtout de l’application très pratique qui permettait de budgéter, de catégoriser et de comparer les dépenses et recettes par rapport à l’année précédente. la nouvelle application est nulle. elle n’est pas lisible (les débits en rouge c’était parfait) aujourd’hui ça ne saute pas aux yeux surtout si on consulte depuis un petit écran. on ne peut pas revenir sur les opérations notamment sur les chèques et noter à quoi ils correspondent. ne plus pouvoir catégoriser enlève l’avantage principal de l’application.",cliente crédit depuis plus 40 ans satisfaite jusqu aujourd hui surtout application très pratique permettait budgéter catégoriser comparer dépenses recettes rapport année précédente nouvelle application nulle lisible débits rouge parfait aujourd hui ça saute yeux surtout si consulte depuis petit écran peut revenir opérations notamment chèques noter quoi correspondent plus pouvoir catégoriser enlève avantage principal application,Positive,0,service
620,Avis Crédit Agricole ,"1,6 sur 5 étoiles",09/07/2022,"banque injoignable, j’ai appelé une cinquantaine de fois l’agence en 1 mois, jamais une seule fois je suis tombé sur un conseiller.conseillère peu professionnelle, ne répond que partiellement à mes mails et se présente 30min en retard lors d’un rendez vous.procédure d’ouverture de compte très peu arrangeante dans mon cas.",banque injoignable appelé cinquantaine fois agence mois jamais seule fois tombé conseiller conseillère peu professionnelle répond partiellement mails présente 30min retard lors rendez procédure ouverture compte très peu arrangeante cas,Positive,0,service
621,Avis Crédit Agricole ,"2,0 sur 5 étoiles",09/07/2022,"la nouvelle application mobile crédit agricole, pas du tout intuitive, beaucoup moins pratique, on peut plus pointer les opérations pour un contrôle, le budget et les statistiques ont disparus. je suis vraiment très déçue. j’utilisais tous les jours cette application qui était géniale - c’était tellement mieux avant, pourquoi avoir fait un si mauvais choix marketing.",nouvelle application mobile crédit agricole tout intuitive beaucoup moins pratique peut plus pointer opérations contrôle budget statistiques disparus vraiment très déçue utilisais tous jours cette application géniale tellement mieux avant pourquoi avoir fait si mauvais choix marketing,Negative,0,service
622,Avis Crédit Agricole ,"2,5 sur 5 étoiles",08/07/2022,"la version 30 de l’application mobile est catastrophique quant à son ergonomie. la présentation n’est absolument pas synthétique. en visualisation des comptes, beaucoup de lignes vides, de multiples tailles de polices de caractère, donc peu d’informations utiles sur une page. peu d’attention envers les utilisateurs.",version 30 application mobile catastrophique quant ergonomie présentation absolument synthétique visualisation comptes beaucoup lignes vides multiples tailles polices caractère donc peu informations utiles page peu attention envers utilisateurs,Positive,0,service
623,Avis Crédit Agricole ,"2,0 sur 5 étoiles",08/07/2022,"client depuis plus de 25 ans, gestion catastrophique d'un emprunt immobilier de 15 000 euros pour un garage qui a été ""oublié"" ; j'ai dû être aidé par le csf (crédit social des fonctionnaires) qui a pu me prêter l'argent en urgence avant le rendez vous chez le notaire. mais il a fallu ensuite 8 jours pour que le virement effectué soit bien crédité sur mon compte, le crédit agricole expliquant qu'il ne sait pas où est l'argent tant qu'il n'est pas effectivement sur le compte. plus de conseiller attitré et tout le monde se renvoie la balle ; aucune excuse y compris de la direction qui n'a jamais proposé de solution alternative. carte gold dite offerte trois ans mais facturée discrètement dès la deuxième année. assurances proposées alléchantes mais qui augmentent de 20% dès la deuxième année.",client depuis plus 25 ans gestion catastrophique emprunt immobilier 15 000 euros garage oublié dû être aidé csf crédit social fonctionnaires pu prêter argent urgence avant rendez chez notaire fallu ensuite jours virement effectué bien crédité compte crédit agricole expliquant sait où argent tant effectivement compte plus conseiller attitré tout monde renvoie balle aucune excuse compris direction jamais proposé solution alternative carte gold dite offerte trois ans facturée discrètement dès deuxième année assurances proposées alléchantes augmentent 20 dès deuxième année,Positive,6,accueil
624,Avis Crédit Agricole ,"2,3 sur 5 étoiles",05/07/2022,"compte ouvert en 1992 et sans problème de fonds. malgré tout : assurance auto, assurance habitation, assurance décès plus avantageuses ailleurs et je compare avec des grands noms sur le marché. même pour un prêt auto, c’était plus avantageux dans une autre banque. maintenant avec ce changement dans l’application, impossibilité de pointer ses opérations ou de les catégoriser. je ne sais pas ce qui me retient chez eux hormis ma fidélité …",compte ouvert 1992 sans problème fonds malgré tout assurance auto assurance habitation assurance décès plus avantageuses ailleurs compare grands noms marché prêt auto plus avantageux autre banque maintenant changement application impossibilité pointer opérations catégoriser sais retient chez hormis fidélité,Positive,1,frais
625,Avis Crédit Agricole ,"2,6 sur 5 étoiles",05/07/2022,"je n’ai rien à dire sur la prestation des conseillers à la banque credit agricole centre france en agence ( annexe parisienne ) ça frôle la perfection . je suis ici pour dénoncer la nullité de la nouvelle application mobile crédit agricole, pas du tout intuitive, beaucoup moins pratique, plus longu , on peut même pas chercher l’historique qui remonte pas assez loin, l’interface est mauvaise. je suis vraiment déçu . je travaillais beaucoup sur mon mobile, je vais devoir changer de mode de travail. c’était tellement mieux avant, pourquoi avoir fait un si mauvais choix marketing.",rien dire prestation conseillers banque credit agricole centre france agence annexe parisienne ça frôle perfection ici dénoncer nullité nouvelle application mobile crédit agricole tout intuitive beaucoup moins pratique plus longu peut chercher historique remonte assez loin interface mauvaise vraiment déçu travaillais beaucoup mobile vais devoir changer mode travail tellement mieux avant pourquoi avoir fait si mauvais choix marketing,Negative,6,accueil
626,Avis Crédit Agricole ,"2,2 sur 5 étoiles",04/07/2022,très déçue de la nouvelle appli qui aurait être mieux et utile aux clients. plus possible d’enregistrer en prévision nos dépenses et recettes. c’était bien pratique pour éviter de n’être pas à découvert prévisionnel de toutes les opérations mensuelles que nous pouvions utiliser et enregistrer à venir. pour moi c’est une régression de l’applicationj’aimais justement le ca pour cela.,très déçue nouvelle appli être mieux utile clients plus possible enregistrer prévision dépenses recettes bien pratique éviter être découvert prévisionnel toutes opérations mensuelles pouvions utiliser enregistrer venir régression applicationj aimais justement ca cela,Negative,0,service
627,Avis Crédit Agricole ,"2,2 sur 5 étoiles",01/07/2022,"le crédit agricole nous a imposé une nouvelle application. il est impossible de gérer ses comptes, de suivre ses dépenses à l'instant et encore moins dans le futur et de les personnaliser. la banque a pris la main sur nos finances en prenant bien soin d'effacer tout l'historique. nous sommes revenus au cahier et crayon du siècle dernier. j'ai surtout la très désagréable impression, qu'en nous empêchant de maîtriser notre budget, le crédit agricole favorise ainsi les ajo.j'ai pris rendez-vous avec la banque en face dès jeudi prochain. il est hors de question de cautionner cette ""prise d'otage"".",crédit agricole imposé nouvelle application impossible gérer comptes suivre dépenses instant encore moins futur personnaliser banque pris main finances prenant bien soin effacer tout historique revenus cahier crayon siècle dernier surtout très désagréable impression empêchant maîtriser budget crédit agricole favorise ainsi ajo pris rendez banque face dès jeudi prochain hors question cautionner cette prise otage,Negative,0,service
628,Avis Crédit Agricole ,"2,2 sur 5 étoiles",27/06/2022,"quand j'ai pris l'assurance habitation pour mon appartement chez eux, ils se sont trompés dans les chiffres et m'ont compté 2 pièces en plus, j'ai donc payé 35€ /mois durant 5 ans avant de me rendre compte que je payais trop. il m'ont donc remboursé la maigre somme de 200€ et m'ont dit qu'ils ne pouvaient pas faire mieux.",quand pris assurance habitation appartement chez trompés chiffres compté pièces plus donc payé 35 mois durant ans avant rendre compte payais trop donc remboursé maigre somme 200 dit pouvaient faire mieux,Negative,3,service
629,Avis Crédit Agricole ,"1,8 sur 5 étoiles",12/05/2022,"fidélité familiale depuis 50 ans. je suis candidate aux élections législatives de juin 2022. ils refusent d'ouvrir mon compte de campagne, alors que j'ai mes comptes perso chez eux depuis 2008. j'avais pourtant ouvert un compte de campagne chez eux pour une précédante élection. refus de cette fois-ci : la règlementation a changé. impossible de voir cette nouvelle règlementation.",fidélité familiale depuis 50 ans candidate élections législatives juin 2022 refusent ouvrir compte campagne alors comptes perso chez depuis 2008 pourtant ouvert compte campagne chez précédante élection refus cette fois ci règlementation changé impossible voir cette nouvelle règlementation,Negative,3,service
630,Avis Crédit Agricole ,5 sur 5 étoiles,03/05/2022,"je suis client à l'agence crédit agricole île-de-france, ma conseillère est vraiment la conseillère idéale : toujours à l'écoute, toujours joignable et quand je lui laisse un message elle rappelle toujours. par de-là cette disponibilité, elle m'a prodigué les meilleurs conseils pour gérer au mieux mon argent et me proposer les produits d'assurance les plus adaptés à ma situation (au crédit agricole les assurances sont efficaces et moins chers qu'à la concurrence). depuis qu'elle me suit elle a toujours été guidée par l'écoute et le professionnalisme. par ailleurs, les autres membres de l'équipe de cette agence sont accueillants et bienveillants avec les clients. je suis tellement satisfait qu'il y a 3 ans j'ai même clôturé mon compte à la sg pour cette agence qui possède même une salle des coffres à prix compétitifs.",client agence crédit agricole île france conseillère vraiment conseillère idéale toujours écoute toujours joignable quand laisse message rappelle toujours là cette disponibilité prodigué meilleurs conseils gérer mieux argent proposer produits assurance plus adaptés situation crédit agricole assurances efficaces moins chers concurrence depuis suit toujours guidée écoute professionnalisme ailleurs autres membres équipe cette agence accueillants bienveillants clients tellement satisfait ans clôturé compte sg cette agence possède salle coffres prix compétitifs,Positive,2,frais
631,Avis Crédit Agricole ,"4,6 sur 5 étoiles",13/04/2022,"je vous conseille de faire le tour de plusieurs agences du crédit agricole car chaque agence décide des clients qu´elle accepte ou non. on m´a refusé dans une agence du crédit agricole de ma ville car je n'avais pas de vrai compte en banque, juste un simple compte sans banque et la conseillère m´a dit qu´aucune agence du groupe ne serait favorable à l'ouverture d'un compte chez eux. j'ai donc décidé d'appeler plusieurs agences du groupe pour leur demander si cela était vrai, j'ai eu plusieurs réponses différentes.j'ai pris rdv dans une agence dans une ville voisine et j´ai été agréablement surpris; on m'a accepté et j'ai était reçu par une conseillère au top. tout se passe très bien dans cette agence.malgré ces péripéties, je vous recommande le crédit agricole, il faut juste tomber sur la bonne agence.",conseille faire tour plusieurs agences crédit agricole car chaque agence décide clients accepte non refusé agence crédit agricole ville car vrai compte banque juste simple compte sans banque conseillère dit aucune agence groupe favorable ouverture compte chez donc décidé appeler plusieurs agences groupe demander si cela vrai plusieurs réponses différentes pris rdv agence ville voisine agréablement surpris accepté reçu conseillère top tout passe très bien cette agence malgré péripéties recommande crédit agricole faut juste tomber bonne agence,Positive,4,service
632,Avis Crédit Agricole ,"4,5 sur 5 étoiles",24/02/2022,"je suis très satisfaite du crédit agricole. ma conseillère me suis depuis de nombreuses années, elle est très réactive (réponse en 24-48h), professionnelle et agréable, tout comme le reste de l'équipe. malgré mes nombreux déplacements à l'étranger elle sait s'adapter. merci à elle!je recommande cette banque sans hésiter!",très satisfaite crédit agricole conseillère depuis nombreuses années très réactive réponse 24 48h professionnelle agréable tout comme reste équipe malgré nombreux déplacements étranger sait adapter merci recommande cette banque sans hésiter,Positive,1,frais
633,Avis Crédit Agricole ,5 sur 5 étoiles,16/02/2022,"crédit agricole de saint denis. conseillère très professionnelle, dynamique et agréable. cela fait plus de dix ans que je suis dans cette banque et j'ai toujours été satisfaite du service. ils sont toujours arrangeants et agréables avec les clients.",crédit agricole saint denis conseillère très professionnelle dynamique agréable cela fait plus dix ans cette banque toujours satisfaite service toujours arrangeants agréables clients,Positive,1,frais
634,Avis Crédit Agricole ,"4,4 sur 5 étoiles",10/02/2022,"merci pour les très bons conseils. je suis très contente que vous m'ayez expliqué la perte d'autonomie car je suis rassurée pour mes parents et moi même, prix fixe et rester le plus longtemps chez moi sans toucher à mon épargne, c'est ce que j'ai retenu. conseiller sympathique qui prendle temps d'expliquer et de répondre aux questions.",merci très bons conseils très contente expliqué perte autonomie car rassurée parents prix fixe rester plus longtemps chez sans toucher épargne retenu conseiller sympathique prendle temps expliquer répondre questions,Positive,0,service
635,Avis Crédit Agricole ,5 sur 5 étoiles,09/02/2022,"conseillère géniale, réactive et toujours joignable. cela est agréable de pouvoir joindre sa conseillère et le traitement de la demande est rapide. si cela n’est pas possible, le traitement est fait en moins de 48h. vraiment le crédit agricole est la meilleure banque à mon avis.",conseillère géniale réactive toujours joignable cela agréable pouvoir joindre conseillère traitement demande rapide si cela possible traitement fait moins 48h vraiment crédit agricole meilleure banque avis,Positive,2,frais
636,Avis Crédit Agricole ,"1,7 sur 5 étoiles",28/12/2021,"le site est bourré de bugs, à chaque fois que l'on télécharge un document, il y a un problème technique. il faut revenir plusieurs fois en arrière et recommencer l'operation pour chaque document. j'avais l'impression de me retrouver dans les années 2000 sur les sites qui ne sont pas aboutis techniquement. pour une banque de ce standing, c'est tout simplement négatif.",site bourré bugs chaque fois télécharge document problème technique faut revenir plusieurs fois arrière recommencer operation chaque document impression retrouver années 2000 sites aboutis techniquement banque standing tout simplement négatif,Positive,2,frais
637,Avis Crédit Agricole ,5 sur 5 étoiles,25/12/2021,j’ai rencontré mon conseiller financier pour l’étude de mon prêt immobilier. il a été très à l’écoute et rassurant pour mon projet. très vite il a mis tout en œuvre pour que mon dossier avance vite. j’ai également assuré mes véhicules et placé mon épargne en suivant ses conseils .merci infiniment pour cet accompagnement.,rencontré conseiller financier étude prêt immobilier très écoute rassurant projet très vite mis tout œuvre dossier avance vite également assuré véhicules placé épargne suivant conseils merci infiniment cet accompagnement,Positive,2,frais
638,Avis Crédit Agricole ,5 sur 5 étoiles,25/11/2021,"je suis très satisfaite de mon agence de vincennes, où j'ai ouvert un compte bancaire depuis peu. le personnel est compétent, disponible et réactif tout en n'étant pas intrusif. les opérations peuvent être réalisées sans souci, que ce soit directement en agence, en ligne ou aux dab. le seul bémol (qui n'est qu'un tout petit détail), c'est d'avoir des relevés de compte ne s'arrêtant pas à la fin du mois mais le 5 du mois suivant.",très satisfaite agence vincennes où ouvert compte bancaire depuis peu personnel compétent disponible réactif tout intrusif opérations peuvent être réalisées sans souci directement agence ligne dab seul bémol tout petit détail avoir relevés compte arrêtant fin mois mois suivant,Positive,6,accueil
639,Avis Crédit Agricole ,"1,6 sur 5 étoiles",08/11/2021,"alors voilà c'est très simple je reçois un héritage et le lendemain je découvre qu un chèque de banque a été émis sans que je sois au courant, soit disant une erreur je n'y crois pas du tout.mais ce n est pas tout mon ancienne propriétaire à trouver le moyen de faire changer le montant de mon loyer par le biais d'un ""agent du crédit agricole"" sans que je soit au courant. bref banque à éviter !",alors voilà très simple reçois héritage lendemain découvre chèque banque émis sans courant disant erreur crois tout tout ancienne propriétaire trouver moyen faire changer montant loyer biais agent crédit agricole sans courant bref banque éviter,Positive,6,accueil
640,Avis Crédit Agricole ,"1,0 sur 5 étoiles",12/10/2021,"fraudes à la carte bancaire non remboursées aux victimes d'arnaque sous couvert de leur système securipass .insécurité du système et rejet de la responsabilité sur les victimes.j´ai été victime d´une fraude à la carte bancaire le 15 juillet 2021 et je n'en suis pas responsable. dépôt de plainte le 16/07 dès qu'on s'aperçoit du problème, opposition à la carte, mais on refuse de me rembourser cherchant à me rendre responsable alors que je n'ai donné aucun code personnel. mieux le service qui gére écrit carrément que le client a fait preuve de négligence en communiquant ses codes, ce qui n'est bien sûr pas le cas! et après plusieurs mails contestant cette décision, un directeur vous appelle pour enfoncer le clou et vous dire que de toute façon vous ne serez pas remboursé même si vous allez en justice. vraiment aucune considération pour leur client, aucune écoute et pas commercial du tout.",fraudes carte bancaire non remboursées victimes arnaque sous couvert système securipass insécurité système rejet responsabilité victimes victime fraude carte bancaire 15 juillet 2021 responsable dépôt plainte 16 07 dès aperçoit problème opposition carte refuse rembourser cherchant rendre responsable alors donné aucun code personnel mieux service gére écrit carrément client fait preuve négligence communiquant codes bien sûr cas après plusieurs mails contestant cette décision directeur appelle enfoncer clou dire toute façon remboursé si allez justice vraiment aucune considération client aucune écoute commercial tout,Positive,3,service
641,Avis Crédit Agricole ,"1,0 sur 5 étoiles",30/08/2021,très mauvaise banque il ne communique pas avec leurs clients il vous baisse le plafond de vos cartes sans prévenir il ne réponde pas à vos mail il ne respecte pas vos demande on ne sait jamais qui est notre conseiller car ça change tous les quatre matin vraiment très déçu. c'est une banque que je déconseille à fuir absolument.,très mauvaise banque communique leurs clients baisse plafond cartes sans prévenir réponde mail respecte demande sait jamais conseiller car ça change tous quatre matin vraiment très déçu banque déconseille fuir absolument,Negative,4,service
642,Avis Crédit Agricole ,"1,0 sur 5 étoiles",26/08/2021,"accueil très antipathique, on vous prend de haut et vous dérangez en y allant.plusieurs problèmes liés à l'application, injoignable par téléphone et j'ai été embêtée avec une caution pour la location de 2 vélos pour 2 heures avec 1600 € bloqués pendant 1mois.la banque ca du xxx n'a pas su m'aider. heureusement que j'ai une autre banque qui a pu compenser les failles du ca.",accueil très antipathique prend haut dérangez allant plusieurs problèmes liés application injoignable téléphone embêtée caution location vélos heures 1600 bloqués pendant 1mois banque ca xxx su aider heureusement autre banque pu compenser failles ca,Positive,6,accueil
643,Avis Crédit Agricole ,"1,0 sur 5 étoiles",18/08/2021,on m'a mal informé sur le rachat d'un crédit et le délai de mise en place du suivant.je suis cliente du crédit agricole depuis plus de 20 ans et n'apprécie pas les réponses agressives de la remplaçante de mon conseiller.mettant en cause ma bonne foi. je crois qu'il serait temps pour moi de changer de banque !!!,mal informé rachat crédit délai mise place suivant cliente crédit agricole depuis plus 20 ans apprécie réponses agressives remplaçante conseiller mettant cause bonne foi crois temps changer banque,Negative,6,accueil
644,Avis Crédit Agricole ,5 sur 5 étoiles,30/07/2021,"bonjour, nous avons pu réaliser notre projet d' achat immobilier grâce à l' accompagnement de notre conseillère.elle est toujours en contact direct avec nous par mail ou sur rendez-vous, elle nous a accompagné jusqu' au bout.nous avons donc pu acheter notre bien avec peu d' apport. merci au crédit agricole !",bonjour pu réaliser projet achat immobilier grâce accompagnement conseillère toujours contact direct mail rendez accompagné jusqu bout donc pu acheter bien peu apport merci crédit agricole,Positive,2,frais
645,Avis Crédit Agricole ,"4,4 sur 5 étoiles",02/07/2021,"l'agence du crédit agricole de houdan ....donc en général ce sont les mécontents qui écrivent.j'ai pris quelques minutes.acceuil, disponibilité, que ce soit sur le réseau pro ou privé ... ne changez rien.j ai créé une association et heureusement l'aide apportée a été très bien au regard de la complexité.",agence crédit agricole houdan donc général mécontents écrivent pris quelques minutes acceuil disponibilité réseau pro privé changez rien créé association heureusement aide apportée très bien regard complexité,Negative,6,accueil
646,Avis Crédit Agricole ,"1,6 sur 5 étoiles",01/07/2021,super à l agence puis prêt refusé après maints avancees par le siège sans même demander des explications.ils se sont basés sur des relevés erronés suite séparation et succession mais aucune question juste un refus alors que ma situation était parfaitement claire avec des explications ( beaucoup d´argent sorti en peu de temps pour payer frais de 2 maisons et impôts suite succession).le crédit agricole n as pas chercher à comprendre....,super agence puis prêt refusé après maints avancees siège sans demander explications basés relevés erronés suite séparation succession aucune question juste refus alors situation parfaitement claire explications beaucoup argent sorti peu temps payer frais maisons impôts suite succession crédit agricole chercher comprendre,Positive,4,service
