,title,rating,date,review,CommentAferPreproc,sentiment,Topic,Topic_label
843,Avis Nickel ,"2,6 sur 5 étoiles",06/07/2021,"banque à fuir.....les conseillers sont nuls.nuls? le mot est faible. je ne sais pas si c'est de l'incompétence ou de l'incurie, quoi que je pencherais pour le second terme. il faut déjà arriver à les joindre, quand au bout de 10 appels vous réussissez à sortir des multiples propositions de la boite vocale pour enfin parler à un être humain, celui-ci est incapable de résoudre votre problème. il faut donc réitérer les appels (cela peut prendre des heures). je me retrouve donc avec une carte périmée alors que sur leur application on vous explique que la cotisation de 20€ comprend le renouvellement de votre cb avant évidemment que celle-ci soit obsolète. mon rsa est bien sur mon compte, mais, aucun moyen d'y avoir accès. j'ai pourtant suivi les instructions à la lettre. de plus, je ne peux même plus me connecter pour avoir accès à mon espace client car mes identifiants sont refusés. je précise que je n'ai absolument rien fait pour mériter ça. aujourd'hui, le 6/7/2021, je ne sais pas comment me sortir de cette situation, j'ai quand même pu leur envoyer un mail, mais il faut plusieurs jours avant d'avoir une réponse.....je leur ai dit que je n'avais pas un euro, mais je ne pense pas que cela les émeuve. je suis complètement impuissant devant des gens qui se foutent complètement de ce qu'il m'arrive et ne sais pas avec quoi je vais manger......ps: ce n'est pas la première fois que j'ai des problèmes avec eux, rien que pour changer un numéro de téléphone dans mes coordonnées j'ai vécu la même chose, c'était juste beaucoup moins grave.",banque fuir conseillers nuls nuls mot faible sais si incompétence incurie quoi pencherais second terme faut déjà arriver joindre quand bout 10 appels réussissez sortir multiples propositions boite vocale enfin parler être humain celui ci incapable résoudre problème faut donc réitérer appels cela peut prendre heures retrouve donc carte périmée alors application explique cotisation 20 comprend renouvellement cb avant évidemment celle ci obsolète rsa bien compte aucun moyen avoir accès pourtant suivi instructions lettre plus peux plus connecter avoir accès espace client car identifiants refusés précise absolument rien fait mériter ça aujourd hui 2021 sais comment sortir cette situation quand pu envoyer mail faut plusieurs jours avant avoir réponse dit euro pense cela émeuve complètement impuissant devant gens foutent complètement arrive sais quoi vais manger ps première fois problèmes rien changer numéro téléphone coordonnées vécu chose juste beaucoup moins grave,Positive,4,service
844,Avis Nickel ,"1,0 sur 5 étoiles",01/07/2021,"on arrive à joindre personne au telje n arrive pas à payer avec ma carte,bref, les 60€ sur mon compte sont perdus. je me suis fais avoir.tout est par internet et on tourne en rond sur le site. j ai mon code secret,de l argent sur le compte et paiement refusé. le plus important,c est de ne pas pouvoir parler à quelqu un, j´en ai marre des répondeurs; tapez 1 etc...",arrive joindre personne telje arrive payer carte bref 60 compte perdus fais avoir tout internet tourne rond site code secret argent compte paiement refusé plus important pouvoir parler quelqu marre répondeurs tapez etc,Positive,4,service
845,Avis Nickel ,"1,0 sur 5 étoiles",23/05/2021,"a fuir !!!!facile d'ouvrir un compte mais un service client pitoyable, toujours pas de nouvelle carte et de l'argent sur mon compte que je peux plus prendre. bref des voleurs... il faut téléphoner 50 fois mais sans succès. les lettres recommandées ne sont pas prises en compte !!!!!!!",fuir facile ouvrir compte service client pitoyable toujours nouvelle carte argent compte peux plus prendre bref voleurs faut téléphoner 50 fois sans succès lettres recommandées prises compte,Positive,4,service
846,Avis Nickel ,"4,3 sur 5 étoiles",19/01/2021,"je suis cliente chez nickel depuis deux ans et je suis très satisfaite de cette banque.l’ouverture de mon compte s’est faite facilement. je suis allée chez un buraliste agréé avec une carte d’identité valide. j’ai payé 20 euros et je suis ressortie du bureau de tabac cinq minutes plus tard avec ma nouvelle carte bancaire.pour ouvrir un compte chez nickel, il n’est pas nécessaire de fournir des justificatifs de revenus. pour moi qui, à l’époque, était interdit bancaire, cela a été une aubaine. les frais sont corrects. il n’est pas possible d’avoir un découvert sur le compte et cela me convient tout à fait.je n’ai jamais eu de souci avec ma carte bancaire et pour peu que l’on soit à l’aise avec internet, il est très simple d’envoyer des virements. je regrette tout de même de ne pas avoir la possibilité d’acquérir un chéquier.",cliente chez nickel depuis deux ans très satisfaite cette banque ouverture compte faite facilement allée chez buraliste agréé carte identité valide payé 20 euros ressortie bureau tabac cinq minutes plus tard nouvelle carte bancaire ouvrir compte chez nickel nécessaire fournir justificatifs revenus époque interdit bancaire cela aubaine frais corrects possible avoir découvert compte cela convient tout fait jamais souci carte bancaire peu aise internet très simple envoyer virements regrette tout avoir possibilité acquérir chéquier,Positive,0,service
847,Avis Nickel ,"4,0 sur 5 étoiles",11/01/2021,"j'ai choisi la banque nickel car il était très facile d'ouvrir un compte.il suffit de se rendre chez un marchand de tabac habilité à vendre des cartes nickel. le compte ne coûte que 20 euros par an, ce qui est très abordable. l'application du compte nickel est plutôt bien faite, on peut consulter son rib, ses comptes et faire un virement.le petit point négatif est le fait que chaque retrait coûte 1 euro de frais quelque soit le montant alors il faut s'organiser pour retirer plus et moins souvent.le compte nickel est aussi intéressant pour les personnes qui ont eu des soucis avec leur banque et qui sont interdits bancaires, ce n'était pas mon cas. il ne faut que votre téléphone, une carte d'identité et 20 euros pour ouvrir le compte.",choisi banque nickel car très facile ouvrir compte suffit rendre chez marchand tabac habilité vendre cartes nickel compte coûte 20 euros an très abordable application compte nickel plutôt bien faite peut consulter rib comptes faire virement petit point négatif fait chaque retrait coûte euro frais quelque montant alors faut organiser retirer plus moins souvent compte nickel aussi intéressant personnes soucis banque interdits bancaires cas faut téléphone carte identité 20 euros ouvrir compte,Positive,0,service
848,Avis Nickel ,"4,8 sur 5 étoiles",10/12/2020,"cela fait 1 an que je suis chez nickel.j'y reçois mon salaire et il n’y a eu aucun souci avec mon compte. je n'ai jamais eu besoin de contacter le service client. j'utilise ma carte bleue tous les jours pour des achats sur internet ou bien en magasin. je n'ai pas eu de soucis de paiement. je n’aime pas les banques traditionnelles alors c'est ma seule banque car tout peut être géré sur mon portable.mais j'ai quand même un compte épargne pour mon avenir. banque vraiment pas chère si l'on sait adapter ses usages à ses tarifs. l'application sur smartphone est simple mais parfaitement fonctionnelle. il n'y a aucune surprise, il faut juste adapter ses usages bancaires aux conditions tarifaires.le seul inconvénient est le manque de chéquier, mais on finit par s’adapter et trouver des alternatives. la banque est interrogée à chaque transaction, mais cela est plutôt rapide maintenant avec la généralisation de l'internet haut-débit.difficile de trouver une banque moins chère. néanmoins, j'aurais aimé un service un peu plus rapide.",cela fait an chez nickel reçois salaire aucun souci compte jamais besoin contacter service client utilise carte bleue tous jours achats internet bien magasin soucis paiement aime banques traditionnelles alors seule banque car tout peut être géré portable quand compte épargne avenir banque vraiment chère si sait adapter usages tarifs application smartphone simple parfaitement fonctionnelle aucune surprise faut juste adapter usages bancaires conditions tarifaires seul inconvénient manque chéquier finit adapter trouver alternatives banque interrogée chaque transaction cela plutôt rapide maintenant généralisation internet haut débit difficile trouver banque moins chère néanmoins aimé service peu plus rapide,Positive,0,service
849,Avis Nickel ,"4,3 sur 5 étoiles",12/10/2020,"nickel! comme son nom l'indique.j'ai pris un compte-nickel parce que je ne répondais pas apparemment, à toutes les attentes pour avoir un compte bancaire classique. à notre époque, il est juste obligatoire d'en avoir un, ne serait-ce que pour effectuer toutes les démarches de la vie quotidienne. c'est important.enfin bref, il me fallait une solution rapide, une alternative. pas besoin d'aller bien loin, je suis juste allé chez le buraliste du coin. ça faisait un moment que je voyais l'offre.j'ai payé 20 euros pour acheter une carte de crédit avec un compte à la clé et un rib. ensuite je me suis enregistré sur une borne avec une pièce d'identité et... voilà, c'est tout. quoi de plus simple. je recommande fortement.",nickel comme nom indique pris compte nickel parce répondais apparemment toutes attentes avoir compte bancaire classique époque juste obligatoire avoir effectuer toutes démarches vie quotidienne important enfin bref fallait solution rapide alternative besoin aller bien loin juste allé chez buraliste coin ça faisait moment voyais offre payé 20 euros acheter carte crédit compte clé rib ensuite enregistré borne pièce identité voilà tout quoi plus simple recommande fortement,Positive,6,accueil
850,Avis Nickel ,"4,8 sur 5 étoiles",30/09/2020,"cela fait maintenant 4 ans que je suis client de la banque nickel et c'est une banque dont je suis satisfait.j'apprécie d'avoir quasiment aucun frais, notamment pour les virements depuis l'étranger, ce qui m'arrive parfois pour des raisons professionnelles. en outre, le service client est très réactif et le seul problème que j'ai rencontré a été rapidement résolu. en effet, alors que ma carte bancaire a été piratée, j'ai simplement du remplacer ma carte bancaire et j'ai rapidement été remboursé.j'apprécie également de pouvoir modifier de nombreux paramètres, notamment le plafond de paiement hebdomadaire très simplement. il me suffit d'aller sur mon compte client et de faire la modification.la carte bancaire est très pratique, notamment depuis qu'elle permet d'effectuer des paiement sans contact.enfin, l'inscription est très simple car il suffit de remplir un formulaire sur une borne et de payer le pack de bienvenue.",cela fait maintenant ans client banque nickel banque dont satisfait apprécie avoir quasiment aucun frais notamment virements depuis étranger arrive parfois raisons professionnelles outre service client très réactif seul problème rencontré rapidement résolu effet alors carte bancaire piratée simplement remplacer carte bancaire rapidement remboursé apprécie également pouvoir modifier nombreux paramètres notamment plafond paiement hebdomadaire très simplement suffit aller compte client faire modification carte bancaire très pratique notamment depuis permet effectuer paiement sans contact enfin inscription très simple car suffit remplir formulaire borne payer pack bienvenue,Positive,0,service
851,Avis Nickel ,5 sur 5 étoiles,17/07/2020,"je trouvais l'idée révolutionnaire alors j'ai décidé d'ouvrir mon compte nickel en 2016.l'inscription s'est déroulée en moins de cinq minutes auprès d'une borne présente dans une grande partie des bureaux de tabac.j'ai du fournir une copie de ma carte d'identité, un numéro de portable et une adresse e-mail. pas besoin de dépôt initial, et les fichés banque de france sont admis.je suis ressorti avec un coffret de bienvenue et une carte mastercard utilisable aussi bien sur le net que dans les commerces.pour moi le compte en banque le plus simple à ouvrir du marché.comme chaque compte bancaire qui se respecte, je dispose d'un espace client pour suivre mon budget ainsi que d'une appli, disponible sur ios et google play. très facile à prendre en main, claire et ergonomique.a ce jour, je n'ai jamais eu besoin de contacter le service clientèle, et j'ai recommandé ce compte à certains membres de ma famille qui en sont pleinement satisfaits.pour le moment aucun découvert n'est autorisé, et aucune offre de crédit n'est proposée. c'est donc idéal pour un compte d'appoint ou pour les budgets serrés.",trouvais idée révolutionnaire alors décidé ouvrir compte nickel 2016 inscription déroulée moins cinq minutes auprès borne présente grande partie bureaux tabac fournir copie carte identité numéro portable adresse mail besoin dépôt initial fichés banque france admis ressorti coffret bienvenue carte mastercard utilisable aussi bien net commerces compte banque plus simple ouvrir marché comme chaque compte bancaire respecte dispose espace client suivre budget ainsi appli disponible ios google play très facile prendre main claire ergonomique jour jamais besoin contacter service clientèle recommandé compte certains membres famille pleinement satisfaits moment aucun découvert autorisé aucune offre crédit proposée donc idéal compte appoint budgets serrés,Positive,6,accueil
852,Avis Nickel ,"4,8 sur 5 étoiles",30/06/2020,"étant au rsa et insatisfaite de ma banque précédente, une amie m'avait conseillé de m'inscrire chez une banque en ligne appelée nickel, il y a 2 mois.je cherchais une banque fiable et sans prélèvements surprises abusifs. je pense vraiment avoir trouvé la bonne banque avec nickel, car elle n'autorise pas le découvert, ce qui me rend vraiment service, étant donné que mes moyens financiers sont très faibles.en plus, les frais de nickel ne s'élèvent qu'à 20 euros par an, qui correspondent à l'achat de la carte prépayée chez un buraliste. elle est donc beaucoup mieux adaptée à ma situation ! j'ai maintenant une carte nickel mastercard qui permet le strict minimum : payer et recevoir de l'argent. certes, elle ne permet pas de disposer d'un chéquier, mais elle est tellement peu chère et pratique comparé à mon ancienne banque, que cela m'importe peu.un jour où mon rsa tardait à être versé, j'ai contacté le service client de nickel sur messenger et ils ont vraiment été réactifs.le seul inconvénient est que l'ajout d'un nouveau bénéficiaire pour faire un virement bancaire prend 24h.",rsa insatisfaite banque précédente amie conseillé inscrire chez banque ligne appelée nickel mois cherchais banque fiable sans prélèvements surprises abusifs pense vraiment avoir trouvé bonne banque nickel car autorise découvert rend vraiment service donné moyens financiers très faibles plus frais nickel élèvent 20 euros an correspondent achat carte prépayée chez buraliste donc beaucoup mieux adaptée situation maintenant carte nickel mastercard permet strict minimum payer recevoir argent certes permet disposer chéquier tellement peu chère pratique comparé ancienne banque cela importe peu jour où rsa tardait être versé contacté service client nickel messenger vraiment réactifs seul inconvénient ajout nouveau bénéficiaire faire virement bancaire prend 24h,Positive,0,service
