,title,rating,date,review,CommentAferPreproc,sentiment,Topic,Topic_label
1449,Avis Neteller ,"1,8 sur 5 étoiles",25/09/2021,"pratique, sauf que si on a la mauvaise idée de la remplir pour les vacances, après 1 utilisation à l'étranger nous voilà, pour notre ""sécurité"", avec une carte bloquée. génial. heureusement que nous avons d'autres cartes et n´avons pas compté uniquement sur cette carte, sinon je n'imagine même pas la galère.cela fait déjà plus de 24h qu´on se bat pour refaire fonctionner notre carte (envoi des pièces d'identité, photo, preuves de notre présence à l'étranger...et toujours rien. certains mails ont même été bloqués... bref, c'est rageant et plus jamais on ne comptera sur cette carte.",pratique sauf si mauvaise idée remplir vacances après utilisation étranger voilà sécurité carte bloquée génial heureusement autres cartes compté uniquement cette carte sinon imagine galère cela fait déjà plus 24h bat refaire fonctionner carte envoi pièces identité photo preuves présence étranger toujours rien certains mails bloqués bref rageant plus jamais comptera cette carte,Positive,3,service
1450,Avis Neteller ,"3,5 sur 5 étoiles",13/04/2021,"j'avais crée un compte neteller pour sécuriser mes achats sur internet.la création de compte requiert une pièce d'identité, des codes de sécurité, rien de très difficile.pour pouvoir lier un compte bancaire existant afin de faire des virements , il m'a fallu faire un premier transfert, et vérifier ensuite un code de vérification, ce qui était assez contraignant.le gros point faible de ce portefeuille électronique est l'argent liquide : 5€ de frais sont prélevés pour chaque retrait à un distributeur !il m'est arrivé d'oublier mon mot de passe : le service client au téléphone était anglais, mais a pu me rediriger vers un technicien francophone pour récupérer mes accès.",crée compte neteller sécuriser achats internet création compte requiert pièce identité codes sécurité rien très difficile pouvoir lier compte bancaire existant afin faire virements fallu faire premier transfert vérifier ensuite code vérification assez contraignant gros point faible portefeuille électronique argent liquide frais prélevés chaque retrait distributeur arrivé oublier mot passe service client téléphone anglais pu rediriger vers technicien francophone récupérer accès,Positive,0,service
1451,Avis Neteller ,"3,7 sur 5 étoiles",04/02/2021,"inscrite sur neteller depuis environ 5 ans pour effectuer des transactions sécurisées sur internet, j'ai relevé des avantages et inconvénients à ce portefeuille en ligne. l'inscription est assez sécurisée : il faut fournir le recto-verso d'une pièce d'identité, qui est vérifiée en quelques jours.pour effectuer des transactions via un compte bancaire, il faut en premier lieu vérifier le compte bancaire, au moyen d'un code, ce qui m'a pris plusieurs jours, ce qui est plutôt contraignant.les services proposés par neteller sont variés : une carte mastercard physique, des investissements en cryptomonnaies, etc.point négatif principal : les frais ! les frais de transferts entrants et sortants sont colossaux (2.5%), et les frais pour retirer de l'argent à un distributeur sont de 5€. c'est surtout pour cela que je n'utilise presque plus neteller désormais.",inscrite neteller depuis environ ans effectuer transactions sécurisées internet relevé avantages inconvénients portefeuille ligne inscription assez sécurisée faut fournir recto verso pièce identité vérifiée quelques jours effectuer transactions via compte bancaire faut premier lieu vérifier compte bancaire moyen code pris plusieurs jours plutôt contraignant services proposés neteller variés carte mastercard physique investissements cryptomonnaies etc point négatif principal frais frais transferts entrants sortants colossaux frais retirer argent distributeur surtout cela utilise presque plus neteller désormais,Positive,3,service
1452,Avis Neteller ,"4,0 sur 5 étoiles",27/12/2020,"j'utilise mon compte neteller avec une carte bancaire virtuelle depuis 3 ans et je suis satisfait par la simplicité de l'utilisation du site web et de l'application dés l'enregistrement.toutes les transactions sont controlées et j'ai toujours un accès facile sur mon compte neteller, dans n'importe quel endroit.mon compte est entièrement vérifié et je peux facilement effectuer des paiements en ligne. les achats avec la carte, que ce soit en ligne ou en magasin, fonctionnent parfaitement.il faut admettre que le retrait sur mon compte bancaire principal peut prendre un certain temps, mais je finis toujours par recevoir mon argent.par contre, j'ai eu des problèmes pour vérifier mon compte au début. mais après quelques courriels, le service client a réussi à compenser cela et j'ai pu continuer à utiliser mon argent. il est aussi difficile de trouver une adresse e-mail pour les contacter, mais je suis satisfait de leur service.",utilise compte neteller carte bancaire virtuelle depuis ans satisfait simplicité utilisation site web application dés enregistrement toutes transactions controlées toujours accès facile compte neteller importe quel endroit compte entièrement vérifié peux facilement effectuer paiements ligne achats carte ligne magasin fonctionnent parfaitement faut admettre retrait compte bancaire principal peut prendre certain temps finis toujours recevoir argent contre problèmes vérifier compte début après quelques courriels service client réussi compenser cela pu continuer utiliser argent aussi difficile trouver adresse mail contacter satisfait service,Positive,0,service
1453,Avis Neteller ,"3,3 sur 5 étoiles",08/10/2020,"j'aime neteller parce qu'il m'a offert de nombreux avantages, parmi lesquels le fait de pouvoir retirer de l'argent à n'importe quel distributeur automatique, de pouvoir retirer en dollars à certains endroits et de ne pouvoir retirer que dans la monnaie du pays.vous pouvez payer avec la carte dans n'importe quel magasin, restaurant, pharmacie ou magasin en général qui accepte les paiements par carte électronique. elle m'a permis d'opter pour une carte de crédit appelée net + et vous pouvez retirer de l'argent liquide avec elle aux distributeurs automatiques. j'apprécié le service qu'il m'a offert.une des choses qui m'ont dégoûté de cette plateforme, c'est qu'aucune plateforme indépendante ne l'offre comme méthode de paiement. donc, en gros, si votre but est de travailler sur peopleperhour, fiverr, nubelo et bien d'autres plateformes, vous pouvez vous débarrasser de neteller pour encaisser vos gains. en ce sens, vous ne trouverez neteller utile que si vous placez des paris en ligne ou si vous dirigez une entreprise indépendante en dehors des plateformes mentionnées ci-dessus.en outre, lorsque je devais effectuer des transactions, je devais parfois payer des frais élevés.",aime neteller parce offert nombreux avantages parmi lesquels fait pouvoir retirer argent importe quel distributeur automatique pouvoir retirer dollars certains endroits pouvoir retirer monnaie pays pouvez payer carte importe quel magasin restaurant pharmacie magasin général accepte paiements carte électronique permis opter carte crédit appelée net pouvez retirer argent liquide distributeurs automatiques apprécié service offert choses dégoûté cette plateforme aucune plateforme indépendante offre comme méthode paiement donc gros si but travailler peopleperhour fiverr nubelo bien autres plateformes pouvez débarrasser neteller encaisser gains sens trouverez neteller utile si placez paris ligne si dirigez entreprise indépendante dehors plateformes mentionnées ci dessus outre lorsque devais effectuer transactions devais parfois payer frais élevés,Positive,3,service
1454,Avis Neteller ,"4,8 sur 5 étoiles",30/06/2020,"il ne faut pas aller loin pour un service de paiement en ligne sécurisé et fiable. moi, j'ai fait confiance à neteller depuis une dizaine d'années. il m'a permis de conserver des fonds, de payer en ligne, de recevoir des cadeaux ou d'envoyer à des proches ou fournisseurs des paiements.pour profiter de tous les services neteller, il m'a fallu ouvrir un compte bancaire. cela n 'avait pris que 5 minutes pour donner toutes les réponses au questionnaire. les questions sont relatives à mes données personnelles. le processus d'enregistrement est gratuit mais il faut fournir une adresse mail valide, un mot de passe et choisir la devise voulue pour les opérations ultérieures. mon compte a été activement après le premier virement de 22,50 euros. il est permis de faire ce dépôt avec un virement bancaire, une carte bleue ou une carte prépayée. pour des raisons de sécurité, le compte est relié à mon compte bancaire en 48 heures.neteller constitue une alternative à la carte bancaire. j'ai ainsi un portefeuille mobile qui sert d'intermédiaire avec les casinos en ligne, les sites bancaires et de ventes partenaires. le compte neteller fonctionne presque un compte courant bancaire. j'ai d'ailleurs bénéficié d'une carte de retrait prépayée éditée en mon nom. je vais au quotidien mes retraits ou mes payments en magasin avec ladite carte. les transferts et dépôts sont très rapides.je peux assurer que c'est l'un des services clients les plus qualifiés en matière de solutions de paiement en ligne. leur site internet est vraiment bien fait et fournit toutes les informations possibles. je suis entré par téléphone et par mail avec le service d'assistance aux clients pour des compléments d'informations.",faut aller loin service paiement ligne sécurisé fiable fait confiance neteller depuis dizaine années permis conserver fonds payer ligne recevoir cadeaux envoyer proches fournisseurs paiements profiter tous services neteller fallu ouvrir compte bancaire cela pris minutes donner toutes réponses questionnaire questions relatives données personnelles processus enregistrement gratuit faut fournir adresse mail valide mot passe choisir devise voulue opérations ultérieures compte activement après premier virement 22 50 euros permis faire dépôt virement bancaire carte bleue carte prépayée raisons sécurité compte relié compte bancaire 48 heures neteller constitue alternative carte bancaire ainsi portefeuille mobile sert intermédiaire casinos ligne sites bancaires ventes partenaires compte neteller fonctionne presque compte courant bancaire ailleurs bénéficié carte retrait prépayée éditée nom vais quotidien retraits payments magasin ladite carte transferts dépôts très rapides peux assurer services clients plus qualifiés matière solutions paiement ligne site internet vraiment bien fait fournit toutes informations possibles entré téléphone mail service assistance clients compléments informations,Positive,3,service
