,title,rating,date,review,CommentAferPreproc,sentiment,Topic,Topic_label
1300,Avis LCL ,"4,2 sur 5 étoiles",28/06/2022,"voilà une banque à l'écoute, réactive, et où l'accueil client est vraiment une belle expérience ! cela fait 6 ans que j'ai un compte chez eux, il y a déjà eu quelques déconvenues mais toutes réglées rapidement et avec le sourire ! on ne prend pas la facilité d'accuser le client, on cherche à comprendre et on trouve une solution, je recommande les yeux fermés !",voilà banque écoute réactive où accueil client vraiment belle expérience cela fait ans compte chez déjà quelques déconvenues toutes réglées rapidement sourire prend facilité accuser client cherche comprendre trouve solution recommande yeux fermés,Positive,4,service
1301,Avis LCL ,"2,8 sur 5 étoiles",15/06/2022,"la valse des conseillers en agences, le manque de réactivité même dans l'urgence. facturation des frais bancaires supplémentaires à la plus petite demande d'agencement de votre prêt immobilier, exemple 350€ l'ajout d'un simple devis. au bout du compte, pas terrible.",valse conseillers agences manque réactivité urgence facturation frais bancaires supplémentaires plus petite demande agencement prêt immobilier exemple 350 ajout simple devis bout compte terrible,Positive,4,service
1302,Avis LCL ,"1,6 sur 5 étoiles",18/05/2022,"je me permets de vous raconter une très mauvaise expérience avec lcl. j’ai été cliente pendant quelques années avant d’opter pour une banque en ligne. naturellement, j’avais demandé à ma conseillère de clôturer mon compte courant au lcl en janvier 2021. des abonnements de type netflix continuaient à être prélevés sur le compte lcl que je n’utilisais plus. de ce fait, j’ai régularisé le compte. ma conseillère m’avait dit qu’elle le clôturerait une fois ce paiement effectué. pensant que tout était en ordre, je ne m’inquiétais plus de cela. puis, en décembre 2021, contre toute attente, je reçois l’appel d’un huissier de justice. apparemment je devais environ 180 euros au lcl. surprise, je les appelle, et j’apprends que le compte n’avait pas été clôturé ! aucun appel de la banque ou du service recouvrement à ce sujet pendant plusieurs mois.j’explique donc en décembre au lcl qu’il y avait eu une erreur de la part de ma conseillère, mais on me dit que sans preuve (mail), on ne peut rien faire pour moi. malheureusement, je ne pouvais plus mettre la main sur le fameux e-mail. a contre cœur, je paie.en avril 2022, en triant ma boite e-mail, je retombe sur l’e-mail, la preuve que j’avais bien demandé la clôture. j’en informe par courrier lcl, puis par téléphone à plusieurs reprises. rien ne se passe. on oublie même de me rappeler ou pire encore, on me met en attente puis on raccroche (alors que je suis toujours très polie et respectueuse au téléphone).",permets raconter très mauvaise expérience lcl cliente pendant quelques années avant opter banque ligne naturellement demandé conseillère clôturer compte courant lcl janvier 2021 abonnements type netflix continuaient être prélevés compte lcl utilisais plus fait régularisé compte conseillère dit clôturerait fois paiement effectué pensant tout ordre inquiétais plus cela puis décembre 2021 contre toute attente reçois appel huissier justice apparemment devais environ 180 euros lcl surprise appelle apprends compte clôturé aucun appel banque service recouvrement sujet pendant plusieurs mois explique donc décembre lcl erreur part conseillère dit sans preuve mail peut rien faire malheureusement pouvais plus mettre main fameux mail contre cœur paie avril 2022 triant boite mail retombe mail preuve bien demandé clôture informe courrier lcl puis téléphone plusieurs reprises rien passe oublie rappeler pire encore met attente puis raccroche alors toujours très polie respectueuse téléphone,Positive,6,accueil
1303,Avis LCL ,"4,8 sur 5 étoiles",06/05/2022,"formidable banque, à l’écoute, des conseillers très réactifs. interactif, cliente très satisfaite. le site offre tous les services à distance si besoin.a chaque fois que j’ai laissé un message sur la messagerie j’ai toujours été rappelé en moins d’une heure. a l’agence le très bon accueil est à noter.",formidable banque écoute conseillers très réactifs interactif cliente très satisfaite site offre tous services distance si besoin chaque fois laissé message messagerie toujours rappelé moins heure agence très bon accueil noter,Positive,0,service
1304,Avis LCL ,"4,0 sur 5 étoiles",12/02/2022,"je suis satisfaite de mon lcl en ligne sur le téléphone car vous pouvez gérer partout où vous êtes. oui, les frais bancaires sont chers par rapport à d'autres banques c'est ce qui devrait être amélioré. j´y suis depuis des années et je n'ai pas eu de gros soucis avec eux. là je les ai appelé pour un souci de payment sur un site de l oph, la carte ne passait pas, ce n'est pas un problème de plafond car celui-ci a déjà été augmenté. j'ai eu ma conseillère qui va faire le nécessaire et en principe cela se passe toujours très bien.",satisfaite lcl ligne téléphone car pouvez gérer partout où oui frais bancaires chers rapport autres banques devrait être amélioré depuis années gros soucis là appelé souci payment site oph carte passait problème plafond car celui ci déjà augmenté conseillère va faire nécessaire principe cela passe toujours très bien,Positive,4,service
1305,Avis LCL ,5 sur 5 étoiles,05/01/2022,"j'ai ouvert mon premier compte dans les années 90, je me souviens de la clarté des explications. je suis donc revenue vers le lcl depuis quelques années : explications claires et détaillés, possibilité de joindre un conseiller en cas de soucis soit par téléphone soit par l'application, qui du reste est très bien faite : sûre, efficace, transparente. ouvrir un compte ou changer de banque avec le lcl est très simple : carte d'identité et un conseiller s'occupe du reste. c'est une banque traditionnelle qui est présente (l'appli permet de gérer à distance) bien mieux qu'une banque en ligne.",ouvert premier compte années 90 souviens clarté explications donc revenue vers lcl depuis quelques années explications claires détaillés possibilité joindre conseiller cas soucis téléphone application reste très bien faite sûre efficace transparente ouvrir compte changer banque lcl très simple carte identité conseiller occupe reste banque traditionnelle présente appli permet gérer distance bien mieux banque ligne,Positive,0,service
1306,Avis LCL ,"4,0 sur 5 étoiles",26/10/2021,"je suis client lcl depuis toujours et je suis globalement satisfait de cette banque.bien qu'il s'agisse d'une banque traditionnelle, j'apprécie l'ergonomie et la facilité d'utilisation de son application, je peux facilement modifier mon plafond et il m'est arrivé d'échanger avec mon conseiller directement depuis cette dernière. je trouve également agréable le fait d'avoir un conseiller attitré, j'ai ainsi eu la possibilité de négocier mes tarifs sur ma carte bleue que j'ai actuellement à un tarif attractif. toutefois, les cartes bancaires gratuites ne sont pas disponibles dans cet établissement ce que je trouve dommage.étant souvent en déplacement, il est important pour moi que je puisse trouver une agence locale lcl partout en france et c'est le cas, il y a en a presque partout ! j'apprécie également que lcl propose un large panel d'offre en fonction de mes revenus et de ma situation : une offre adaptée lorsque j'étais étudiant mais également une à l'obtention de mon premier emploi.",client lcl depuis toujours globalement satisfait cette banque bien agisse banque traditionnelle apprécie ergonomie facilité utilisation application peux facilement modifier plafond arrivé échanger conseiller directement depuis cette dernière trouve également agréable fait avoir conseiller attitré ainsi possibilité négocier tarifs carte bleue actuellement tarif attractif toutefois cartes bancaires gratuites disponibles cet établissement trouve dommage souvent déplacement important puisse trouver agence locale lcl partout france cas presque partout apprécie également lcl propose large panel offre fonction revenus situation offre adaptée lorsque étudiant également obtention premier emploi,Positive,0,service
1307,Avis LCL ,"2,5 sur 5 étoiles",18/01/2021,"très peu proche de sa clientèle.lcl a été ma première banque lorsque j'étais étudiante. a l'époque, je ne savais pas encore comment gérer un budget, et ils ne m'ont proposé aucune solution adaptée, pouvant limiter mes dépenses par exemple.je me suis vite retrouvée avec un découvert de 800€, ce qui, à l'âge que j'avais alors, représentait une somme astronomique et insurmontable.j'ai fini à la banque de france à 18 ans... tout ça, sans jamais qu'un conseiller ne me propose un rendez-vous. inadmissible.",très peu proche clientèle lcl première banque lorsque étudiante époque savais encore comment gérer budget proposé aucune solution adaptée pouvant limiter dépenses exemple vite retrouvée découvert 800 âge alors représentait somme astronomique insurmontable fini banque france 18 ans tout ça sans jamais conseiller propose rendez inadmissible,Positive,5,personnel
1308,Avis LCL ,"4,3 sur 5 étoiles",12/01/2021,"j’ai ouvert mon compte courant lcl à paris dans les années 90 car il y avait une succursale proche de mon domicile.j’ai apprécié de pouvoir changer d’agence lorsque j’ai déménagé en allemagne, puis au havre et enfin sur rouen, tout en gardant le même numéro de compte. lorsque j’ai voulu faire construire ma maison, je me suis tournée naturellement vers ma banque pour un crédit logement. j’ai toujours été bien accompagnée par la conseillère qui a toujours été claire dans ses explications.j’ai ouvert un 2ème compte dans une autre banque car malheureusement, il n’y a pas de crédit lyonnais où j’habite. mais j’ai conservé le compte lcl tout en le gérant à distance sur internet, sans difficulté car le site est pratique, fluide et clair.",ouvert compte courant lcl paris années 90 car succursale proche domicile apprécié pouvoir changer agence lorsque déménagé allemagne puis havre enfin rouen tout gardant numéro compte lorsque voulu faire construire maison tournée naturellement vers banque crédit logement toujours bien accompagnée conseillère toujours claire explications ouvert 2ème compte autre banque car malheureusement crédit lyonnais où habite conservé compte lcl tout gérant distance internet sans difficulté car site pratique fluide clair,Positive,0,service
1309,Avis LCL ,"4,8 sur 5 étoiles",06/12/2020,"je suis client lcl depuis mon plus jeune âge et jusqu’à ce jour, sous aucun prétexte je ne changerais de banque.la majeure partie des conseillers à qui on a confié la gestion de mon compte ont toujours fait preuve d'un grand professionnalisme et d'une sympathie hors-norme. j'ai énormément apprécié leur bienveillance, leur compréhension dans des moments difficiles auxquels j'ai du faire face. leur capacité d'écoute ainsi que leur réactivité sont pour ma part exemplaires. avec mon expérience passée chez lcl, je vous recommande vivement les services de cette banque qui sait chaque jour être auprès de ses clients.en ce qui concerne le service client, je les ai contacté à de nombreuses reprises et ils ont toujours été courtois et serviables; mon problème était toujours réglé en moins de 24 heures, quel qu´en soit la nature.si je devais trouver un problème à cette banque, je dirais que ce sont les frais, qui sont plus élevés compte-tenu de la concurrence exercée par les banques en ligne; mais cela est compréhensible vu que c'est une banque physique et non pas en ligne.",client lcl depuis plus jeune âge jusqu jour sous aucun prétexte changerais banque majeure partie conseillers confié gestion compte toujours fait preuve grand professionnalisme sympathie hors norme énormément apprécié bienveillance compréhension moments difficiles auxquels faire face capacité écoute ainsi réactivité part exemplaires expérience passée chez lcl recommande vivement services cette banque sait chaque jour être auprès clients concerne service client contacté nombreuses reprises toujours courtois serviables problème toujours réglé moins 24 heures quel nature si devais trouver problème cette banque dirais frais plus élevés compte tenu concurrence exercée banques ligne cela compréhensible vu banque physique non ligne,Positive,4,service
1310,Avis LCL ,"2,0 sur 5 étoiles",19/10/2020,"lcl est ma banque depuis de nombreuses années.d'une manière générale, leur service client ainsi que leur réactivité laisse à désirer.l'application en revanche, est très pratique et fonctionnelle depuis qu'elle a été améliorée.je regrette quand même le débit en direct qui n'apparait pas, contrairement à certaines banques. lors d'envoi de message par la messagerie interne à l'application, le temps de réponse est parfois long, et il faut souvent les relancer. je trouve de manière générale que le service à la clientèle est mauvais.",lcl banque depuis nombreuses années manière générale service client ainsi réactivité laisse désirer application revanche très pratique fonctionnelle depuis améliorée regrette quand débit direct apparait contrairement certaines banques lors envoi message messagerie interne application temps réponse parfois long faut souvent relancer trouve manière générale service clientèle mauvais,Positive,0,service
1311,Avis LCL ,5 sur 5 étoiles,19/10/2020,"suite à un souhait de renégociation de prêt immobilier, mon courtier m'a orienté vers la banque lcl qui proposait un taux très intéressant ainsi que des conditions d'assurance liées au prêt très attractives.ma conseillère m'a bien expliqué la procédure de rachat du crédit immobilier à mon ancienne banque. les frais liés à ce rachat n'ont pas été sous-estimés ni dissimulés.a cette occasion, mes comptes courant et d'épargne, livret a et ldd, ont également été transférés au lcl.le transfert s'est fait simplement, en transparence. ma conseillère a toujours su être réactive et à l'écoute sur les questions que je me posais ( avantage d'une carte bancaire par rapport à une autre par exemple ).pour la gestion de mes comptes, je peux accéder facilement au site du lcl et à leur application. ils sont simples et intuitifs pour la navigation. si besoin, je peux contacter ma conseillère via la messagerie. les échanges sont rapides et efficaces.",suite souhait renégociation prêt immobilier courtier orienté vers banque lcl proposait taux très intéressant ainsi conditions assurance liées prêt très attractives conseillère bien expliqué procédure rachat crédit immobilier ancienne banque frais liés rachat sous estimés ni dissimulés cette occasion comptes courant épargne livret ldd également transférés lcl transfert fait simplement transparence conseillère toujours su être réactive écoute questions posais avantage carte bancaire rapport autre exemple gestion comptes peux accéder facilement site lcl application simples intuitifs navigation si besoin peux contacter conseillère via messagerie échanges rapides efficaces,Positive,3,service
1312,Avis LCL ,"4,5 sur 5 étoiles",13/10/2020,"j'ai souscrit à un pel en ligne très rapidement et sans problème, en consultant simplement la documentation en ligne, qui était très complète.j'aurais aimé que les conditions de souscription de ce produit bancaire soient plus favorables au client.l'interface du site lcl est plutôt ergonomique et facile d'utilisation, même si parfois il peut y avoir quelques bugs. je n'ai jamais utilisé l'application.j'ai déjà eu plusieurs contacts avec le service clientèle, et que ce soit par messagerie ou par téléphone, l'échange s'est toujours fait de façon fluide et cordiale.",souscrit pel ligne très rapidement sans problème consultant simplement documentation ligne très complète aimé conditions souscription produit bancaire plus favorables client interface site lcl plutôt ergonomique facile utilisation si parfois peut avoir quelques bugs jamais utilisé application déjà plusieurs contacts service clientèle messagerie téléphone échange toujours fait façon fluide cordiale,Positive,0,service
1313,Avis LCL ,"4,0 sur 5 étoiles",20/07/2020,"en ligne, de façon générale, j’apprécie l’organisation du site internet de lcl, qui permet de trouver facilement le service recherché, selon que l’on souhaite s’informer ou souscrire, réaliser des opérations courantes ou se renseigner sur ses comptes et produits. j’utilise essentiellement l’accès à l’ensemble de mes comptes qui m’offre une vision détaillée de mes dépenses.cela m’a permis de constater plusieurs débits d’une société chez laquelle je n’avais réalisé aucun frais, que j’ai signalés auprès de mon conseiller par messagerie. réactif, il a fait en sorte que je sois remboursée dans la semaine et m’a rapidement fait parvenir une nouvelle carte bancaire.l’assistance à la clientèle a également fait preuve de réactivité lors de ma demande d’informations sur les équivalences de monnaie et frais que cela impliquait pour un voyage à l’étranger.sur ce point, j’aurais toutefois préféré une consultation personnalisée plutôt que l’envoi d’un document général qui exposait toutes les hypothèses de déplacement dans le monde, en fonction des différentes cartes bancaires et leurs particularités.",ligne façon générale apprécie organisation site internet lcl permet trouver facilement service recherché selon souhaite informer souscrire réaliser opérations courantes renseigner comptes produits utilise essentiellement accès ensemble comptes offre vision détaillée dépenses cela permis constater plusieurs débits société chez laquelle réalisé aucun frais signalés auprès conseiller messagerie réactif fait sorte remboursée semaine rapidement fait parvenir nouvelle carte bancaire assistance clientèle également fait preuve réactivité lors demande informations équivalences monnaie frais cela impliquait voyage étranger point toutefois préféré consultation personnalisée plutôt envoi document général exposait toutes hypothèses déplacement monde fonction différentes cartes bancaires leurs particularités,Positive,0,service
1314,Avis LCL ,"4,7 sur 5 étoiles",11/07/2020,"j’ai ouvert un compte courant au lcl il y a environ 10 ans ainsi qu’un livret jeune à l’époque, que j’ai transformé en livret a par la suite. la procédure a été simple et rapide : j’ai pris rendez-vous en agence, puis présenté une pièce d’identité ainsi qu’un justificatif de domicile.je suis globalement satisfaite de cette banque. je peux facilement prendre rendez-vous avec mon conseiller par téléphone ou en agence via le site internet ou l’application (calendrier des disponibilités). mes différents conseillers ont toujours été sympathiques, arrangeants et réactifs. ils me proposent des services (comptes, assurances…), sans toutefois me forcer la main, chose que j’apprécie.j’utilise souvent l’application, que je trouve très pratique pour consulter mes comptes ou effectuer des virements. et la possibilité de faire opposition est bien utile en cas de vol ou perte, notamment à l’étranger.en revanche, les frais restent assez élevés lorsque je retire hors zone euro, même avec une carte bancaire plus haut de gamme. je regrette qu’il n'existe pas de cb plus adaptées pour l’étranger chez lcl, moi qui voyage régulièrement.",ouvert compte courant lcl environ 10 ans ainsi livret jeune époque transformé livret suite procédure simple rapide pris rendez agence puis présenté pièce identité ainsi justificatif domicile globalement satisfaite cette banque peux facilement prendre rendez conseiller téléphone agence via site internet application calendrier disponibilités différents conseillers toujours sympathiques arrangeants réactifs proposent services comptes assurances sans toutefois forcer main chose apprécie utilise souvent application trouve très pratique consulter comptes effectuer virements possibilité faire opposition bien utile cas vol perte notamment étranger revanche frais restent assez élevés lorsque retire hors zone euro carte bancaire plus haut gamme regrette existe cb plus adaptées étranger chez lcl voyage régulièrement,Positive,0,service
1315,Avis LCL ,"4,0 sur 5 étoiles",30/06/2020,"j'ai actuellement des rapports positifs avec ma banque lcl.toutefois, j'ai rencontré quelques désagréments au début.lorsque mes parents m'ont ouvert un compte à la fin du lycée, la banque a retiré 10 euros et n'a pas su m'expliquer le motif ...depuis, je surveille mon compte mais cela ne s'est pas reproduit.depuis quelques années, j'ai un nouveau conseiller bancaire. il est très professionnel, à l'écoute et ne se limite pas au strict aspect financier. il peut rembourser des frais de manière exceptionnelle ou aménager des signatures de contrats.sur internet, je peux me connecter à mon compte sur leur site et procéder à différents actes. cela facilite les transactions et évite les déplacements.s'il y a une critique négative à faire, c'est que je reste liée à la 1ère agence et celle qui est à proximité de mon nouveau domicile ne peut me venir en aide.",actuellement rapports positifs banque lcl toutefois rencontré quelques désagréments début lorsque parents ouvert compte fin lycée banque retiré 10 euros su expliquer motif depuis surveille compte cela reproduit depuis quelques années nouveau conseiller bancaire très professionnel écoute limite strict aspect financier peut rembourser frais manière exceptionnelle aménager signatures contrats internet peux connecter compte site procéder différents actes cela facilite transactions évite déplacements critique négative faire reste liée 1ère agence celle proximité nouveau domicile peut venir aide,Positive,6,accueil
