,title,rating,date,review,CommentAferPreproc,sentiment,Topic,Topic_label
394,Avis Caisse d'Épargne ,"3,8 sur 5 étoiles",06/10/2020,"mon compte à la caisse d'epargne, je l'ai ouvert en 2003 afin de disposer de ma toute première carte bleue. la souscription à un forfait satellis essentiel n'avait alors pas posé de problème, j'avais même bénéficié d'un an de gratuité du service en guise de cadeau de bienvenue.globalement, la qualité de service a toujours été au rendez-vous. le problème se situe plutôt au niveau de la relation client : difficile d'instaurer la confiance quand votre conseiller financier change tous les six mois...côté tarifs, quelque peu agacé à l'idée de devoir débourser 10 euros par mois pour disposer d'une carte bancaire et de mon argent, j'ai récemment sauté le pas pour migrer vers une banque en ligne. gratuité totale et services innovants, je ne regrette en rien ma décision. j'ai tout de même conservé mon livret a à la caisse d'épargne afin d'avoir accès à un conseiller si nécessaire.",compte caisse epargne ouvert 2003 afin disposer toute première carte bleue souscription forfait satellis essentiel alors posé problème bénéficié an gratuité service guise cadeau bienvenue globalement qualité service toujours rendez problème situe plutôt niveau relation client difficile instaurer confiance quand conseiller financier change tous six mois côté tarifs quelque peu agacé idée devoir débourser 10 euros mois disposer carte bancaire argent récemment sauté migrer vers banque ligne gratuité totale services innovants regrette rien décision tout conservé livret caisse épargne afin avoir accès conseiller si nécessaire,Positive,2,frais
395,Avis Caisse d'Épargne ,5 sur 5 étoiles,03/10/2020,"ma femme et moi sommes devenus clients à la caisse d'epargne lors de l'achat de notre appartement.la première conseillère que nous avions vue n'était pas très aimable, mais elle a très vite été remplacée par une personne plus à l'écoute et plus patiente avec nous. tout s'est donc fait très facilement : ouverture du compte, obtention des cartes bancaires, assurances de prêt, etc. bien sûr, au vu de tous les documents à compléter et à signer cela avait pris beaucoup de temps, mais pas plus qu'il n'en fallait.depuis, nous utilisons les services par internet, qui sont plutôt faciles d'utilisation. il est rare que nous ayons à faire avec des personnes physiques.malgré la première personne que nous avons rencontrée, nous avons de très bonnes relations avec cette société.",femme devenus clients caisse epargne lors achat appartement première conseillère vue très aimable très vite remplacée personne plus écoute plus patiente tout donc fait très facilement ouverture compte obtention cartes bancaires assurances prêt etc bien sûr vu tous documents compléter signer cela pris beaucoup temps plus fallait depuis utilisons services internet plutôt faciles utilisation rare faire personnes physiques malgré première personne rencontrée très bonnes relations cette société,Positive,0,service
396,Avis Caisse d'Épargne ,"2,0 sur 5 étoiles",30/09/2020,"la caisse d’epargne fut ma première banque. dès mes 16 ans, j’ouvrais un compte dans une agence, sans véritablement me poser de questions. j’ai été client pendant plus de 15 ans.si vous êtes nouveau client, je vous recommande vivement de fuir cet établissement au plus vite. l’interface est médiocre, le service téléphonique ou en agence est déplorable, voire inexistant. je ne compte plus les déboires administratifs… chèques perdus, perte de documents, facturations indues, régularisations non prises en compte, refus de crédit immobilier (alors que je disposais des ressources), agents bancaires au bord de la crise de nerf qui pleuraient devant moi…non seulement, cette banque n’est pas digne de confiance mais son organisation interne est inhumaine. a fuir !",caisse epargne première banque dès 16 ans ouvrais compte agence sans véritablement poser questions client pendant plus 15 ans si nouveau client recommande vivement fuir cet établissement plus vite interface médiocre service téléphonique agence déplorable voire inexistant compte plus déboires administratifs chèques perdus perte documents facturations indues régularisations non prises compte refus crédit immobilier alors disposais ressources agents bancaires bord crise nerf pleuraient devant non seulement cette banque digne confiance organisation interne inhumaine fuir,Positive,4,service
397,Avis Caisse d'Épargne ,"4,5 sur 5 étoiles",11/07/2020,"je suis cliente à la caisse d'épargne depuis près de 25 ans, pour un compte courant classique.j'ai également une assurance prévoyance, qui me semble être à un prix tout à fait correct (je n'ai actuellement pas fait de comparatifs ailleurs).les contacts avec la banque sont simples, je n'ai pas souvent besoin de les contacter. c'est plutôt mon banquier qui essaye de me joindre pour me proposer des devis d'assurances ou autres services, néanmoins leurs tarifs en matière d'assurance ne m'intéressent pas particulièrement. en ce qui me concerne, j'ai toujours pu avoir rendez-vous rapidement quand j'en ai eu besoin, et l'accueil en agence m'a satisfait à chaque fois.j'utilise aussi l'application caisse d'épargne sur mon smartphone, aucun souci de ce côté là, elle est simple d'utilisation et toutes les fonctionnalités nécessaires dans la vie courante sont disponibles.",cliente caisse épargne depuis près 25 ans compte courant classique également assurance prévoyance semble être prix tout fait correct actuellement fait comparatifs ailleurs contacts banque simples souvent besoin contacter plutôt banquier essaye joindre proposer devis assurances autres services néanmoins leurs tarifs matière assurance intéressent particulièrement concerne toujours pu avoir rendez rapidement quand besoin accueil agence satisfait chaque fois utilise aussi application caisse épargne smartphone aucun souci côté là simple utilisation toutes fonctionnalités nécessaires vie courante disponibles,Positive,0,service
398,Avis Caisse d'Épargne ,5 sur 5 étoiles,25/06/2020,"tous mes comptes sont à la caisse d'epargne, et ceci depuis toujours. et c'était déjà le cas pour mes parents et mes grands-parents. autant vous dire que chez nous, cette banque est une affaire de famille!depuis quelques années, mon mari et moi avons choisi le service en ligne uniquement, et nous en sommes plus que satisfaits.nous avons demandé notre prêt immobilier et notre prêt auto auprès d'eux, le tout s'est passé sans encombre et très rapidement.en cas de problème, il nous suffit de téléphoner à notre conseiller, et notre souci est réglé au plus vite, nous n'avons aucun repproche à faire à notre banque, jamais eu le moindre souci!",tous comptes caisse epargne ceci depuis toujours déjà cas parents grands parents autant dire chez cette banque affaire famille depuis quelques années mari choisi service ligne uniquement plus satisfaits demandé prêt immobilier prêt auto auprès tout passé sans encombre très rapidement cas problème suffit téléphoner conseiller souci réglé plus vite aucun repproche faire banque jamais moindre souci,Positive,2,frais
