,title,rating,date,review,CommentAferPreproc,sentiment,Topic,Topic_label
647,Avis Crédit Agricole ,5 sur 5 étoiles,19/06/2021,"ayant besoin d'un credit consommation, j'ai pris contact avec ma conseillère mme xxx.prise de rdv pour le lendemain et la décision au bout de 24 heures. je suis très satisfait par le travail formidable de ma conseillère dans ma banque à alfortville. elle était à l'écoute de mon projet et mes besoins et elle a pris la décision adéquate.j'en profite de la présente et je remercie pour l'accueil sympatique du directeur de la banque.très bonne banque avec un bon contact humain, je recommande à mes proches.",besoin credit consommation pris contact conseillère mme xxx prise rdv lendemain décision bout 24 heures très satisfait travail formidable conseillère banque alfortville écoute projet besoins pris décision adéquate profite présente remercie accueil sympatique directeur banque très bonne banque bon contact humain recommande proches,Positive,2,frais
648,Avis Crédit Agricole ,5 sur 5 étoiles,15/06/2021,"agence de venerque (31) super à l'écoute très bons conseillers.j'apprécie d'avoir la même conseillère depuis 22 ans, ça c'est énorme car elle connait votre vie, votre honnêté et quand elle est congé tous les autres conseillers me trouvent des solutions. j’adore ! mais il faut être honnête avec eux, d´où la relation client = banque!super super",agence venerque 31 super écoute très bons conseillers apprécie avoir conseillère depuis 22 ans ça énorme car connait vie honnêté quand congé tous autres conseillers trouvent solutions adore faut être honnête où relation client banque super super,Positive,5,personnel
649,Avis Crédit Agricole ,5 sur 5 étoiles,09/06/2021,"très bonne banque à l'écoute des clients.je recommande vivement, c'est top de pouvoir avoir confiance à ceux qui gèrent notre argent.le crédit agricole normandie est super ! j'ai toujours été à cette banque ce qui donne des avantages fidélité, cela est vraiment bien pour nous fidéliser. merci beaucoup.",très bonne banque écoute clients recommande vivement top pouvoir avoir confiance ceux gèrent argent crédit agricole normandie super toujours cette banque donne avantages fidélité cela vraiment bien fidéliser merci beaucoup,Positive,1,frais
650,Avis Crédit Agricole ,"2,2 sur 5 étoiles",19/05/2021,"je suis cliente depuis plus de dix ans au crédit agricole et j'ai souscrit à la mutuelle pacifica chez eux.je n'ai jamais eu de problème, jusqu'au jour où 400 euros ont été débités sur mon compte le 7 février 2020. je n'ai toujours pas été remboursée malgré la constitution d'un dossier de fraude et des dizaines d'emails...depuis, trois conseillers successifs se sont amusés à faire silence radio une fois que les documents demandés (dépôt de plainte, ouverture d'un dossier de fraude) leur ont été envoyés. le dossier de fraude a été ouvert mais est resté sans suite. les différents conseillers ne répondent plus ni à mes mails, ni à mes appels, et même ma réclamation auprès du service client est restée sans suite.cela fait 1 an et 4 mois que cela dure.",cliente depuis plus dix ans crédit agricole souscrit mutuelle pacifica chez jamais problème jusqu jour où 400 euros débités compte février 2020 toujours remboursée malgré constitution dossier fraude dizaines emails depuis trois conseillers successifs amusés faire silence radio fois documents demandés dépôt plainte ouverture dossier fraude envoyés dossier fraude ouvert resté sans suite différents conseillers répondent plus ni mails ni appels réclamation auprès service client restée sans suite cela fait an mois cela dure,Positive,4,service
651,Avis Crédit Agricole ,"1,0 sur 5 étoiles",16/05/2021,"fraudes à la carte bancaire non remboursés aux victimes d'arnaque. insécurité du système et rejette la responsabilité sur les victimes.j´ai été victime dune fraude à la carte bancaire le 26 mars 2021 et je n'en suis pas responsable, mais on refuse de me rembourser cherchant par tous les moyens de me rendre responsable alors que je n'ai donné aucun code personnel.",fraudes carte bancaire non remboursés victimes arnaque insécurité système rejette responsabilité victimes victime dune fraude carte bancaire 26 mars 2021 responsable refuse rembourser cherchant tous moyens rendre responsable alors donné aucun code personnel,Positive,3,service
652,Avis Crédit Agricole ,"1,0 sur 5 étoiles",05/05/2021,"bonjour, je n ai jamais eu autant de soucis avec le crédit agricole.là j ai eu fraude vis à vis de ma cb. 330€ de débiter depuis le 7avril. portez plainte sauf que à cette heure ci, rien! ca m exaspère cette banque ets´ il n y avait que ça. il y a toujours quelque chose.je ne conseille à personne cette banque.",bonjour jamais autant soucis crédit agricole là fraude vis vis cb 330 débiter depuis 7avril portez plainte sauf cette heure ci rien ca exaspère cette banque ets ça toujours quelque chose conseille personne cette banque,Neutral,2,frais
653,Avis Crédit Agricole ,"1,0 sur 5 étoiles",10/04/2021,"j'ai fait une demande de financement sur le service en ligne pour acheter un véhicule, le montant du prêt demandé était, je le reconnais, trés élevé 4000€!un conseiller en ligne me donne un rendez vous téléphonique et m'appele au jour et à l'heure dites, aprés m'avoir posé de nombreuses questions sur divers sujets, assurance, epargne etc, je me permets de lui dire que je veux juste qu'il étudie ma demande de financement, sa réponse: ""vous croyez que nous sommes un distributeur de credit"".il enchaine sur un questionnement poussé sur mon épargne et ma facon d'épargner ""virement permanent ou de temps en temps"". ma patience commencant à atteindre ses limites, j'ai mis fin a cette conversation et je vais acheter mon vehicule avec mon ""épargne"".",fait demande financement service ligne acheter véhicule montant prêt demandé reconnais trés élevé 4000 conseiller ligne donne rendez téléphonique appele jour heure dites aprés avoir posé nombreuses questions divers sujets assurance epargne etc permets dire veux juste étudie demande financement réponse croyez distributeur credit enchaine questionnement poussé épargne facon épargner virement permanent temps temps patience commencant atteindre limites mis fin cette conversation vais acheter vehicule épargne,Positive,6,accueil
654,Avis Crédit Agricole ,"1,0 sur 5 étoiles",19/03/2021,"banque avec des pratiques commerciales très douteuses.dans le cadre d'une demande de financement pour un achat locatif, j'ai rencontré le ca languedoc qui m'a fait la meilleure proposition tarifaire.j'ai dû changer l'ensemble des mes comptes perso/pro puis d'attendre 2 mois pour me voir signifier un refus après les conditions suspensives au passage.tu te retrouves clients à 100% mais ton projet ne se réalise pas.ils ont fait l'entonnoir afin que je ne puisse pas aller voir leurs confrères.je précise que l'ensemble des documents furent transmis au préalable.",banque pratiques commerciales très douteuses cadre demande financement achat locatif rencontré ca languedoc fait meilleure proposition tarifaire dû changer ensemble comptes perso pro puis attendre mois voir signifier refus après conditions suspensives passage retrouves clients 100 projet réalise fait entonnoir afin puisse aller voir leurs confrères précise ensemble documents transmis préalable,Positive,4,service
655,Avis Crédit Agricole ,"1,0 sur 5 étoiles",01/02/2021,crédit agricole international isle de france.très mauvais service clientèle. pas de système pour résoudre des problèmes. j’étais obligé de passer par le médiateur.attitude bizarre pour une banque internationale avec un client de 10 ans.quand j'ai porté plainte mes e-mails étaient ignorés. la conseillère a bloqué toutes mes demandes de parler avec son supérieur.même le service clientèle de la banque n'a pas répondu à mes emails pour essayer de résoudre le problème.,crédit agricole international isle france très mauvais service clientèle système résoudre problèmes obligé passer médiateur attitude bizarre banque internationale client 10 ans quand porté plainte mails ignorés conseillère bloqué toutes demandes parler supérieur service clientèle banque répondu emails essayer résoudre problème,Negative,6,accueil
656,Avis Crédit Agricole ,"4,3 sur 5 étoiles",01/02/2021,"je suis cliente au crédit agricole depuis 5 ans.j'ai premièrement ouvert un livret a et un livret jeune. j'ai bien été renseignée quant aux différences et aux intérêts de chacun. mon conseiller m'a tout expliqué et l'ouverture de ces livrets a été rapide et facile.en ce qui concerne l'application mobile, je l'utilise et la consulte quotidiennement. je la trouve particulièrement pratique, simple et intuitive. elle me permet de faire toutes les opérations qui me sont utiles et d'avoir recours à l'ensemble des informations dont j'ai besoin. lors de mises à jour, un tutoriel est proposé afin de nous aider au mieux.le service client est quant à lui très réactif, j'ai toujours été bien accueillie, conseillée et aiguillée. il est facile de prendre contact avec la banque, que ce soit par téléphone ou par email. en cas de besoin la demande est traitée rapidement, parfois même instantanément.",cliente crédit agricole depuis ans premièrement ouvert livret livret jeune bien renseignée quant différences intérêts chacun conseiller tout expliqué ouverture livrets rapide facile concerne application mobile utilise consulte quotidiennement trouve particulièrement pratique simple intuitive permet faire toutes opérations utiles avoir recours ensemble informations dont besoin lors mises jour tutoriel proposé afin aider mieux service client quant très réactif toujours bien accueillie conseillée aiguillée facile prendre contact banque téléphone email cas besoin demande traitée rapidement parfois instantanément,Positive,0,service
657,Avis Crédit Agricole ,"1,0 sur 5 étoiles",18/01/2021,"bonjour,j'ai été pendant de nombreuses années secrétaire d'une association à but non lucratif.en 2015, le président et moi-même avions pris rendez-vous au sein de l'agence du crédit agricole dans le but de signer une procuration à mon nom. en 2016, j'ai effectué un retrait de 40,00 € en montrant la procuration au conseiller. malheureusement le président est décédé en décembre 2019. j'ai pris rendez- vous afin de connaitre le montant du solde disponible. a ma stupéfaction, il me dit que la procuration n'a jamais été enregistrée et qu'il ne pouvait pas me communiquer le solde disponible.le crédit agricole a commis deux grosses erreurs: non enregistrement de la procuration et autorisation d'un retrait de 40,00 € après la signature de la procuration.suite à de nombreux entretiens, le directeur a reconnu les erreurs commises et après m'avoir annoncé le montant du solde, j'ai immédiatement soldé le compte et mis fin à la collaboration avec le crédit agricole.",bonjour pendant nombreuses années secrétaire association but non lucratif 2015 président pris rendez sein agence crédit agricole but signer procuration nom 2016 effectué retrait 40 00 montrant procuration conseiller malheureusement président décédé décembre 2019 pris rendez afin connaitre montant solde disponible stupéfaction dit procuration jamais enregistrée pouvait communiquer solde disponible crédit agricole commis deux grosses erreurs non enregistrement procuration autorisation retrait 40 00 après signature procuration suite nombreux entretiens directeur reconnu erreurs commises après avoir annoncé montant solde immédiatement soldé compte mis fin collaboration crédit agricole,Negative,6,accueil
658,Avis Crédit Agricole ,"3,8 sur 5 étoiles",01/12/2020,"je suis client du crédit agricole (brie picardie) depuis une dizaine d'année.détenteur d'un compte-courant, d'un livret a et d'un pel, leurs services sont satisfaisants, et des conseillers sont joignables par téléphone facilement ou par mail (réponse dans les 24h ouvrées). même si les tarifs sont assez élevés, des gestes commerciaux peuvent être pratiqués, en réduisant les frais d'irrégularités et d'incidents par exemple. cependant, les procédures pour ouvrir des comptes ou plans d'épargne peuvent sembler chronophage, en rendant par exemple obligatoire le rendez-vous avec un conseiller.la plateforme en ligne / l'application sont assez simples d'utilisation et complètes. on peut également y trouver des informations sur les différents produits financiers existants au sein du crédit agricole, ce qui est intéressant quand on cherche à financer ses projets. quelques transactions restent un peu contraignantes, comme le fait de ne pas pouvoir enregistrer des rib hors crédit agricole sans l'aval d'un conseiller.il serait intéressant que cette banque adopte une démarche plus responsable d'un point de vue sociétal et environnemental, en arrêtant de financer des projets polluants notamment.dans l'ensemble, je suis satisfait de mon expérience consommateur au crédit agricole.",client crédit agricole brie picardie depuis dizaine année détenteur compte courant livret pel leurs services satisfaisants conseillers joignables téléphone facilement mail réponse 24h ouvrées si tarifs assez élevés gestes commerciaux peuvent être pratiqués réduisant frais irrégularités incidents exemple cependant procédures ouvrir comptes plans épargne peuvent sembler chronophage rendant exemple obligatoire rendez conseiller plateforme ligne application assez simples utilisation complètes peut également trouver informations différents produits financiers existants sein crédit agricole intéressant quand cherche financer projets quelques transactions restent peu contraignantes comme fait pouvoir enregistrer rib hors crédit agricole sans aval conseiller intéressant cette banque adopte démarche plus responsable point vue sociétal environnemental arrêtant financer projets polluants notamment ensemble satisfait expérience consommateur crédit agricole,Positive,0,service
659,Avis Crédit Agricole ,"3,8 sur 5 étoiles",02/11/2020,"mon avis concerne le crédit agricole, ma banque depuis que j'ai commencé à travailler à l'adolescente.j'ai ouvert un compte jeune à l'époque que ma banque a vite fait évolué au fur et à mesure des changements de vie et de ma situation. un compte commun a été ouvert avec mon compagnon. les opérations ont toujours été fluides et claires. je n'ai jamais eu à déplorer de manquements ou d'incompréhensions jusqu'à l'arrivée de pléthores de fonctionnalités en ligne.un service client régional difficile à atteindre et déplaisant jusqu'à ce qu'on démange et change d'agence régionale : nos interlocuteurs sont désormais réactifs et font preuve de gentillesse. comme quoi, tout dépend des employés.",avis concerne crédit agricole banque depuis commencé travailler adolescente ouvert compte jeune époque banque vite fait évolué fur mesure changements vie situation compte commun ouvert compagnon opérations toujours fluides claires jamais déplorer manquements incompréhensions jusqu arrivée pléthores fonctionnalités ligne service client régional difficile atteindre déplaisant jusqu démange change agence régionale interlocuteurs désormais réactifs font preuve gentillesse comme quoi tout dépend employés,Positive,2,frais
660,Avis Crédit Agricole ,"2,8 sur 5 étoiles",19/10/2020,"je suis emmanuelle et je suis cliente du crédit agricole depuis le mois de février 2020.je dois dire que j’ai un avis mitigé sur le crédit agricole. j’ai opté pour cette banque car elle m’a présenté la meilleure offre de prêt dans le cadre de l’achat de mon bien immobilier. je ne connaissais pas avant le principe des banques coopératives et je trouve ça intéressant. mon enregistrement chez eux avec tous les papiers s'est déroulé de manière assez efficace mais un peu trop rapide à mon goût ; de ce fait, je déplore le service clientèle reçu qui selon moi, dépend surtout du conseiller sur qui l’on tombe. tout est toujours évasif, je reçois le minimum d’explication : j’ai toujours trouvé nos échanges qu’ils soient via la messagerie interne ou même physiquement, assez expéditifs.en dehors de cela, j’aime beaucoup la plateforme web.j’ai mon crédit immobilier chez le crédit agricole mais en raison d’une expérience clientèle décevante, je n’y resterai pas nécessairement cliente longtemps.",emmanuelle cliente crédit agricole depuis mois février 2020 dois dire avis mitigé crédit agricole opté cette banque car présenté meilleure offre prêt cadre achat bien immobilier connaissais avant principe banques coopératives trouve ça intéressant enregistrement chez tous papiers déroulé manière assez efficace peu trop rapide goût fait déplore service clientèle reçu selon dépend surtout conseiller tombe tout toujours évasif reçois minimum explication toujours trouvé échanges via messagerie interne physiquement assez expéditifs dehors cela aime beaucoup plateforme web crédit immobilier chez crédit agricole raison expérience clientèle décevante resterai nécessairement cliente longtemps,Positive,0,service
661,Avis Crédit Agricole ,"4,3 sur 5 étoiles",15/10/2020,"le crédit agricole m’a proposé plusieurs offres pour que nous puissions trouver ensemble celle qui me correspondait le mieux.les procédures étaient simples et il y avait toujours quelqu’un pour répondre à mes questions. les fonctionnalités sont faciles d’accès et sécurisées, parfois même un peu trop puisqu’un numéro de téléphone est requis pour la plupart des achats et des identifications en ligne.je n’ai pas eu à faire avec le service client mais le personnel des agences est compétent, sympathique et à l’écoute.",crédit agricole proposé plusieurs offres puissions trouver ensemble celle correspondait mieux procédures simples toujours quelqu répondre questions fonctionnalités faciles accès sécurisées parfois peu trop puisqu numéro téléphone requis plupart achats identifications ligne faire service client personnel agences compétent sympathique écoute,Positive,0,service
662,Avis Crédit Agricole ,"4,8 sur 5 étoiles",20/07/2020,"je possède plusieurs comptes bancaires chez eux. pel, jeune, chèque, et le dernier en date : le livret a. en étant déjà cliente, l’ouverture de ce dernier compte fut simple et rapide. j’ai naturellement contacté mon conseiller sur la plateforme mobile. après avoir reçu une réponse dans les jours qui ont suivi, j’ai pu signer électroniquement mes documents et mon compte est apparu sans délai sur mon application.en ce qui concerne leur service téléphonique, j’ai récemment pris contact avec ma banque pour obtenir des informations sur l’assurance téléphone qu’ils proposent. à la fin de l’entretien, bien que j’ai pu poser toutes les questions auxquelles je pensais, je restais indécise. on m’a alors suggéré que le contrat soit transféré sur mon espace personnel, ainsi je peux le signer à tout moment.à mon sens, une seule chose manque sur l’application : la possibilité de bloquer sa carte de crédit directement sur celle-ci. mis à part cette mise à jour que j’espère voir apparaitre sur leur plateforme mobile je n’ai jamais eu de problème avec cette banque ou un de leur service. lors de mon voyage en australie il y a 2 ans ils ont été très réactifs au sujet des papiers à effectuer avant mon départ (garant, autorisation de bénéficier étrangère, etc.). le crédit agricole a toujours répondu à mes questions avec bienveillance.",possède plusieurs comptes bancaires chez pel jeune chèque dernier date livret déjà cliente ouverture dernier compte simple rapide naturellement contacté conseiller plateforme mobile après avoir reçu réponse jours suivi pu signer électroniquement documents compte apparu sans délai application concerne service téléphonique récemment pris contact banque obtenir informations assurance téléphone proposent fin entretien bien pu poser toutes questions auxquelles pensais restais indécise alors suggéré contrat transféré espace personnel ainsi peux signer tout moment sens seule chose manque application possibilité bloquer carte crédit directement celle ci mis part cette mise jour espère voir apparaitre plateforme mobile jamais problème cette banque service lors voyage australie ans très réactifs sujet papiers effectuer avant départ garant autorisation bénéficier étrangère etc crédit agricole toujours répondu questions bienveillance,Positive,0,service
663,Avis Crédit Agricole ,"4,3 sur 5 étoiles",11/07/2020,"je me souviens de mon premier rendez-vous chez crédit agricole alors que j'étais encore mineure. tout s'était bien déroulé. l'ouverture du compte s'est faite très facilement et en un temps plutôt court. le conseiller, nous ayant agréablement bien reçus, avait su répondre à tous nos questionnements.en revanche, lors de mes 18 ans, j'ai pu rencontrer quelques complications. durant un an environ, sans le savoir, j'étais toujours considérée comme mineure, ce qui posait vraiment problème lors de certains paiements.à ce moment-là, j'ai dû contacter le service clientèle par téléphone qui m'a répondu très rapidement. grâce à leurs explications claires, j'ai vite compris la non-prise en compte de mon passage à la majorité, pourtant indiqué lors d'un entretien avec un conseiller. le problème a aussitôt été réglé.j'utilise assez régulièrement l'application ma banque du crédit agricole pour consulter mes dépenses directement sur mon téléphone et j'en suis plutôt satisfaite. de temps en temps, je me connecte en ligne pour modifier mes informations personnelles ou pour éditer un rib.je suis, dans l'ensemble, plutôt contente du crédit agricole et de ses fonctionnalités.",souviens premier rendez chez crédit agricole alors encore mineure tout bien déroulé ouverture compte faite très facilement temps plutôt court conseiller agréablement bien reçus su répondre tous questionnements revanche lors 18 ans pu rencontrer quelques complications durant an environ sans savoir toujours considérée comme mineure posait vraiment problème lors certains paiements moment là dû contacter service clientèle téléphone répondu très rapidement grâce leurs explications claires vite compris non prise compte passage majorité pourtant indiqué lors entretien conseiller problème aussitôt réglé utilise assez régulièrement application banque crédit agricole consulter dépenses directement téléphone plutôt satisfaite temps temps connecte ligne modifier informations personnelles éditer rib ensemble plutôt contente crédit agricole fonctionnalités,Positive,0,service
664,Avis Crédit Agricole ,"3,8 sur 5 étoiles",30/06/2020,"je suis pleinement satisfaite de leurs produits et de leurs services.j'ai souscrit à divers produits financiers tels que compte courant, compte sur livret, plan d'épargne en actions.je les ai récemment contactés afin d'ouvrir un compte pour mon fils de 14 ans avec une carte mozaïc de retrait. tous les renseignements utiles m'ont été délivrés par téléphone et un simple rendez-vous, obtenu très rapidement, a été nécessaire pour finaliser la procédure.je n'ai aucune difficulté pour les joindre par téléphone bien que je préfère me rendre sur leur site internet pour des informations d'ordre général, ou sur l'application sur smartphone ""ma banque"" qui fonctionne très bien et me permet de consulter mon compte, effectuer des virements, commander des chéquiers ou prendre rendez-vous.les contacts que j'ai pu avoir se sont toujours bien déroulés mais je regrette néanmoins que les conseillers clientèle changent régulièrement et ne soient parfois pas suffisamment formés pour traiter des sujets spécifiques : un second rendez-vous m'a déjà été proposé par mon conseiller qui n'était pas en mesure de me renseigner sur les investissements immobiliers et leur financement.",pleinement satisfaite leurs produits leurs services souscrit divers produits financiers tels compte courant compte livret plan épargne actions récemment contactés afin ouvrir compte fils 14 ans carte mozaïc retrait tous renseignements utiles délivrés téléphone simple rendez obtenu très rapidement nécessaire finaliser procédure aucune difficulté joindre téléphone bien préfère rendre site internet informations ordre général application smartphone banque fonctionne très bien permet consulter compte effectuer virements commander chéquiers prendre rendez contacts pu avoir toujours bien déroulés regrette néanmoins conseillers clientèle changent régulièrement parfois suffisamment formés traiter sujets spécifiques second rendez déjà proposé conseiller mesure renseigner investissements immobiliers financement,Positive,0,service
