,title,rating,date,review,CommentAferPreproc,sentiment,Topic,Topic_label
1420,Avis ING ,"1,8 sur 5 étoiles",21/07/2021,"bonjour,je souhaite faire part de ma dernière expérience avec ing.je suis client ing depuis 4 ans environ. je suis salarié en cdi avec des revenus, que j'estime corrects. mon compte n'a jamais présenté le moindre découvert depuis 4 ans. je n'ai pas de crédits à ce jour et mon solde moyen représente environ 6 mois de salaire. je pense être donc un client 'sain'.pour la période de vacances, j'ai demandé à ing d'augmenter mon plafond de carte ; je loue en effet mon véhicule durant cette période et il faut savoir que le montant de la caution, s'il n'est pas prélevé compte parmi les montants prélevés sur la période de 30 jours glissants.il y a un an, durant l'été 2020, j'avais souhaité augmenter mon plafond de carte. ing m'avait répondu que cette opération ne pouvait se faire depuis leur site mais qu'une demande par téléphone pouvait suffire et qu'une étude de mon profil suffirait pour avoir un accord. accord qui ne devait pas poser de problème étant donné mon profil.aujourd'hui, ing vient de m'annoncer que leur logiciel était en panne sans date de retour à la normale prévue. je ne peux donc augmenter mon plafond de carte, avec tous les désagréments que cela suppose... caution avec la carte bancaire de mon épouse, paiements en espèce.après consultation du forum ing, il s'avère que l'autorisation d'augmentation du plafond carte n'est plus possible depuis mai 2020 et qu'il n'y a aucun dysfonctionnement logiciel ni demande spécifique possible.dans de nombreuses banques physiques ou en ligne, cette opération est disponible après analyse du profil et du compte.je ne peux donc rester client d'ing à ce jour si ce besoin 'normal' ne peut être traité. par ailleurs, comment faire confiance à un établissement bancaire qui n'est pas capable d'avoir un discours cohérent et sincère.je souhaite donc mettre en alerte tous les clients actuels et potentiels sur ce point qui se révèle être un vrai désagrément.",bonjour souhaite faire part dernière expérience ing client ing depuis ans environ salarié cdi revenus estime corrects compte jamais présenté moindre découvert depuis ans crédits jour solde moyen représente environ mois salaire pense être donc client sain période vacances demandé ing augmenter plafond carte loue effet véhicule durant cette période faut savoir montant caution prélevé compte parmi montants prélevés période 30 jours glissants an durant 2020 souhaité augmenter plafond carte ing répondu cette opération pouvait faire depuis site demande téléphone pouvait suffire étude profil suffirait avoir accord accord devait poser problème donné profil aujourd hui ing vient annoncer logiciel panne sans date retour normale prévue peux donc augmenter plafond carte tous désagréments cela suppose caution carte bancaire épouse paiements espèce après consultation forum ing avère autorisation augmentation plafond carte plus possible depuis mai 2020 aucun dysfonctionnement logiciel ni demande spécifique possible nombreuses banques physiques ligne cette opération disponible après analyse profil compte peux donc rester client ing jour si besoin normal peut être traité ailleurs comment faire confiance établissement bancaire capable avoir discours cohérent sincère souhaite donc mettre alerte tous clients actuels potentiels point révèle être vrai désagrément,Positive,6,accueil
1421,Avis ING ,"4,0 sur 5 étoiles",28/01/2021,"je suis client depuis plusieurs années chez ing et j'en tire une bonne expérience.l'ouverture du compte a été réalisée très rapidement.ce compte me permet de gérer aisément toutes mes opérations courantes tout en ayant un appoint en épargne.comme client, chaque opération me paraît simple, beaucoup plus facile à réaliser qu'avec une banque ""classique"".par exemple, pour un virement bancaire, il me suffit de quelques clics et d'une vérification par sms pour valider l'envoi de fonds vers un autre compte. pour un client interne à ing, l'argent est même virée instantanément !de mon point de vue, l'interface est ergonomique et simple d'utilisation.et le gros intérêt pour moi d'ing : tout est gratuit.",client depuis plusieurs années chez ing tire bonne expérience ouverture compte réalisée très rapidement compte permet gérer aisément toutes opérations courantes tout appoint épargne comme client chaque opération paraît simple beaucoup plus facile réaliser banque classique exemple virement bancaire suffit quelques clics vérification sms valider envoi fonds vers autre compte client interne ing argent virée instantanément point vue interface ergonomique simple utilisation gros intérêt ing tout gratuit,Positive,0,service
1422,Avis ING ,5 sur 5 étoiles,28/01/2021,"je suis client chez ing depuis une dizaine d'années au moins et je suis totalement satisfait par la totalité des services proposés.pour moi ce n'est pas seulement une alternative à un compte dans une banque traditionnelle, c'est vraiment ma banque principale.tout se fait en ligne ou par téléphone et je trouve cela définitivement pratique. mes comptes sont accessibles 24h/24 et 7jours/7. les frais sont nuls dans la mesure où je ne suis jamais à découvert, je gère tout depuis mon pc, virements, parrainages, ouverture de compte, demande de prêt.lorsque j'ai affaire à des conseillers par téléphone ils sont toujours courtois et efficaces.que pourrais-je bien demander de plus ?",client chez ing depuis dizaine années moins totalement satisfait totalité services proposés seulement alternative compte banque traditionnelle vraiment banque principale tout fait ligne téléphone trouve cela définitivement pratique comptes accessibles 24h 24 7jours frais nuls mesure où jamais découvert gère tout depuis pc virements parrainages ouverture compte demande prêt lorsque affaire conseillers téléphone toujours courtois efficaces pourrais bien demander plus,Positive,0,service
1423,Avis ING ,"4,3 sur 5 étoiles",10/01/2021,"je suis client d'ing depuis 2006. depuis 15 ans, je suis globalement satisfait des services fournis (application mobile, horaires de l'agence, banque en ligne, ...). les contacts avec l'agence sont aisés. des réponses rapides sont données à mes questions. même en cas de désaccord, on trouve une solution.le seul bémol est la taux d'intérêt infime accordé sur le compte d'épargne. mais, actuellement, c'est le cas dans toutes les banques.j'ai été particulièrement satisfait du service rendu lors d'un refinancement de mon prêt hypothécaire. le taux proposé était intéressant et me permet d'économiser plusieurs centaines d'euros sur le remboursement de ce prêt. les documents ont rapidement été rédigés et validés. donc, j'évalue cette expérience à 5 étoiles.",client ing depuis 2006 depuis 15 ans globalement satisfait services fournis application mobile horaires agence banque ligne contacts agence aisés réponses rapides données questions cas désaccord trouve solution seul bémol taux intérêt infime accordé compte épargne actuellement cas toutes banques particulièrement satisfait service rendu lors refinancement prêt hypothécaire taux proposé intéressant permet économiser plusieurs centaines euros remboursement prêt documents rapidement rédigés validés donc évalue cette expérience étoiles,Positive,0,service
1424,Avis ING ,"4,8 sur 5 étoiles",06/12/2020,"cliente depuis 7 ans chez ing, je n'ai jamais été déçue par cette banque en ligne. m'inscrire a été facile, et une fois les documents demandés remis, j'ai pu bénéficier d'un compte, d'une carte et d'un chéquier en moins de dix jours.le service client est joignable jusque tard le soir et ce tous les jours, c'est bien plus pratique que chez une banque physique.la possibilité de gérer sa carte (changement de code, modification du plafond, bloquage de la carte) directement depuis son espace en ligne est un gros plus, on est complètement autonome pour gérer notre compte bancaire.c'est également très agréable de pouvoir bénéficier d'une mastercard gold et de la plupart des opérations en ligne gratuitement.l'application est pratique et très intuitive, facile d'utilisation.c'est une banque que je recommande vivement notamment lorsqu'il s'agit d'avoir tout simplement un compte courant qui ne vous coûte rien.",cliente depuis ans chez ing jamais déçue cette banque ligne inscrire facile fois documents demandés remis pu bénéficier compte carte chéquier moins dix jours service client joignable jusque tard soir tous jours bien plus pratique chez banque physique possibilité gérer carte changement code modification plafond bloquage carte directement depuis espace ligne gros plus complètement autonome gérer compte bancaire également très agréable pouvoir bénéficier mastercard gold plupart opérations ligne gratuitement application pratique très intuitive facile utilisation banque recommande vivement notamment lorsqu agit avoir tout simplement compte courant coûte rien,Positive,0,service
1425,Avis ING ,"4,8 sur 5 étoiles",11/10/2020,"j’étais cliente d’ing en banque physique pendant des décennies et j’en étais très satisfaite.les démarches étaient simples, le service client était toujours disponible pour répondre à mes demandes.lorsque ing direct est arrivée sur le net, je me suis précipitée. le dossier d’enregistrement était plutôt simple et j’ai reçu un bonus à l’ouverture de compte. j’étais ravie.je craignais d’avoir un service moins performant mais je me suis trompée. dès mes premières demandes, j’ai reçu une réponse précise. je peux joindre le service client de plusieurs manières et je continue de recevoir un service de qualité.régulièrement, je reçois même des offres qui me rémunèrent pour des achats avec ma carte de crédit.",cliente ing banque physique pendant décennies très satisfaite démarches simples service client toujours disponible répondre demandes lorsque ing direct arrivée net précipitée dossier enregistrement plutôt simple reçu bonus ouverture compte ravie craignais avoir service moins performant trompée dès premières demandes reçu réponse précise peux joindre service client plusieurs manières continue recevoir service qualité régulièrement reçois offres rémunèrent achats carte crédit,Positive,0,service
1426,Avis ING ,"4,5 sur 5 étoiles",11/07/2020,"je suis cliente chez ing depuis maintenant plus de quinze ans et je n'ai jamais été déçue par leur prestations.j'ai été inscrite par ma mère lorsque j'étais vraiment jeune mais lorsque l'heure est venue de vraiment choisir ma banque, c'est ing que j'ai choisi de garder à mes côtés.lorsque j'avais une question ou un doute, ils m'ont toujours accueillie et assistée que ce soit parce que je voulais ouvrir un nouveau compte ou acquérir une carte de crédit. très réactif, j'ai toujours pu avoir un rendez-vous dans la semaine qui venait.j'ai quelques handicaps et ing s'est toujours adaptée à moi pour me soutenir malgré les inconvénients que je vis ou à l'incompéhension que j'éprouve face à certaines étapes lors de l'utilisation de mon compte.de plus, la plateforme en ligne est rapide, simple et efficace, ce qui est parfait pour quelqu'un comme moi qui ne peut pas me déplacer à longueur de temps.",cliente chez ing depuis maintenant plus quinze ans jamais déçue prestations inscrite mère lorsque vraiment jeune lorsque heure venue vraiment choisir banque ing choisi garder côtés lorsque question doute toujours accueillie assistée parce voulais ouvrir nouveau compte acquérir carte crédit très réactif toujours pu avoir rendez semaine venait quelques handicaps ing toujours adaptée soutenir malgré inconvénients vis incompéhension éprouve face certaines étapes lors utilisation compte plus plateforme ligne rapide simple efficace parfait quelqu comme peut déplacer longueur temps,Positive,0,service
1427,Avis ING ,"4,7 sur 5 étoiles",30/06/2020,"je suis très satisfaite d'ing, chez qui j'ai ouvert un compte courant (avec carte gold) gratuit il y plusieurs mois déjà.en tout et pour tout, du jour où je me suis inscrite en ligne au jour où ma carte était utilisable, il s'est passé 3 semaines. on reçoit la carte par la poste, et son code un peu plus tard, par la poste aussi.depuis l'application, j'ai pu augmenter mon débit autorisé hyper facilement, chose que je ne pouvais pas faire avec mon ancienne banque, ayant de petits revenus.le service client m'a téléphoné de lui même quelque temps après mon inscription, pour me rappeler les procédures etc, ce qui m'a plu, d'autant que la personne au téléphone parlait très bien et me comprenais bien aussi (je dis ça car certains services clients parlent à peine français.) je n'ai cependant pas encore eu besoin de les appeler donc ne saurai les juger pour ce qui est de la résolution de problèmes.ils ont aussi un système de parrainage très cool, j'ai donc profité de 8 euros offerts, et ma mère également, à l'ouverture de son compte.",très satisfaite ing chez ouvert compte courant carte gold gratuit plusieurs mois déjà tout tout jour où inscrite ligne jour où carte utilisable passé semaines reçoit carte poste code peu plus tard poste aussi depuis application pu augmenter débit autorisé hyper facilement chose pouvais faire ancienne banque petits revenus service client téléphoné quelque temps après inscription rappeler procédures etc plu autant personne téléphone parlait très bien comprenais bien aussi dis ça car certains services clients parlent peine français cependant encore besoin appeler donc saurai juger résolution problèmes aussi système parrainage très cool donc profité euros offerts mère également ouverture compte,Positive,6,accueil
1428,Avis ING ,"4,3 sur 5 étoiles",25/06/2020,"cliente d’ing direct depuis 2018, je me permets de vous partager ci-dessous mon expérience.très réticente face aux banques en ligne, j’ai finalement franchi le pas en créant un compte joint avec mon compagnon.nous souhaitions avoir un compte commun, mais nous ne souhaitions pas faire un choix entre nos deux banques. ing direct s’est imposé à nous comme la meilleure opportunité. nous avions la possibilité d’avoir une carte gold mastercard, avec une masse conséquente d’avantages, pour une modique somme de 5€ par mois si nous versions moins de 1200€/mois. une aubaine !l’interface est claire, le site internet est intuitif et simple. l’ensemble des fonctions est accessible et pensé pour nous faciliter la vie. l’application a été améliorée, mais il est parfois encore complexe d’obtenir un rib ou des relevés de compte.nous nous sommes empressés de faire les démarches d’ouverture, faciles et 100% en ligne. quelques minutes plus tard, nous étions clients et nous attendions nos cartes ainsi que notre chéquier. nous n’avons jamais eu recours au service client, mais je n’ai aucun doute face à leur engagement.",cliente ing direct depuis 2018 permets partager ci dessous expérience très réticente face banques ligne finalement franchi créant compte joint compagnon souhaitions avoir compte commun souhaitions faire choix entre deux banques ing direct imposé comme meilleure opportunité possibilité avoir carte gold mastercard masse conséquente avantages modique somme mois si versions moins 1200 mois aubaine interface claire site internet intuitif simple ensemble fonctions accessible pensé faciliter vie application améliorée parfois encore complexe obtenir rib relevés compte empressés faire démarches ouverture faciles 100 ligne quelques minutes plus tard clients attendions cartes ainsi chéquier jamais recours service client aucun doute face engagement,Positive,0,service
